Contador,Autor,Año,Título,Publicado,Area
6502,"Kirchhoff, Paul",1948,The Guayupe and Sae.,"Handbook of South American Indians, ed., Julian Steward. vol 4:385-391.",Arqueología Colombiana
5522,"Kroonenberg, Salomón y  Hans Diederx",1985,Geología.,"Arqueología regional en el valle de La Plata, Colombia, ed.,  Robert Drennan. pp 24-40 University of Michigan, Technical Reports. Ann Arbor.",Arqueología Colombiana
8989,"Kruschek, Michael",2003,The evolution of the Bogotá chiefdom: a household view.,"Ph.D dissertation. Departmento of Anthropology, University of Pittsburg.",Arqueología Colombiana
6505,"Kurella, Doris",1998,The Muisca. Chiefdoms in Transition,"Chiefdoms and Chieftaincy in the Americas, ed., Elsa M. Redmond, pp 189-215. University of Florida Press.",Arqueología Colombiana
32841,"Kusimba, Chapurukha M.",2008,Early African cities; their role in shaping of urban and rural interaction spheres,"The ancient city. New perspectives in the Old and New World, eds Joyce Marcus & Jeremy A. Sabloff, pp 229-246. A school for advanced research residential scholar book, Santa fe, New Mexico.",Arqueología Colombiana
35904,Langebaek Carl Henrik  & Héctor García Botero,2009,Etnólogos y trabajo de campo. Infidencias de cartas y diarios,"Arqueología y etnología en Colombia: la creación de una tradición científica, eds., Carl Henrik Langebaek & Clara Isabel Botero, pp 269-312. Bogotá: Universidad de los Andes, Facultad de Ciencias Sociales, CESO, Ediciones Uniandes",Arqueología Colombiana
26203,"Langebaek Rued, Carl Henrik; Jaramillo Gonzale, Alejandra; Aristizábal, Lucero; Bernal Arévalo, Marcela; Corcione, María Antonieta; Mendoza, Luisa Fernanda; Pérez, Luz; Rodríguez, Freddy; Zorro, Catalina",2015,Vivir y morir en Tibanica: reflexiones sobre el poder y el espacio en una aldea muisca tardía de la sabana de Bogotá,"Revista Colombiana de Antropología, 51(2): 173-207",Arqueología Colombiana
9151,"Langebaek Rueda, Carl",2004,Secuencia y porcesos. Estudio comparativo del desarrollo de jerarquías de asentamiento prehispánicas en el norte se Sudamérica.,"Revista de Arqueologia del Área Intermedia, 6:199-248",Arqueología Colombiana
9092,"Langebaek, Carl Henrik",2004,Dossier: historia y ciencias sociales historia y arqueología. encuentros y desencuentros.,"Historia Crítica, 27, enero-junio. http://historiacritica.uniandes.edu.co/html/27/art_langebaek.htm",Arqueología Colombiana
4903,"Langebaek, Carl Henrik",1995,Algunos comentarios sobre cambios diacronicos en el intercambio prehispánico en el norte del Ecuador y sur de Colombia: revisión de la evidencia.,"Perspectivas regionales en la arqueología del suroccidente de Colombia y norte del Ecuador, ed., Cristóbal Gnecco,  pp. 314-330. Editorial Universidad del Cauca, Popayán.",Arqueología Colombiana
36097,"Langebaek, Carl Henrik",1987,Algunos aspectos de la economía Tairona en el litoral adyacente a Cienaga (Magdalena).,"Maguare, 5:59-72.",Arqueología Colombiana
5226,"Langebaek, Carl Henrik",1987,Dispersión geográfica y contenido simbólico de la cerámica Guatavita desgrasante tiesto: un ensayo de interpretación.,"Revista de Antropología Universidad de los Andes, 3(2):115-129.",Arqueología Colombiana
5855,"Langebaek, Carl Henrik",1986,Las ofrendas en los Andes septentrionales de influencia Chibcha. El caso de un ofrendatario Muisca encontrado en Fontibón.,"Boletín del Museo del Oro, 16:40-47.",Arqueología Colombiana
9101,"Langebaek, Carl Henrik",0,Génesis del grupo. Universidad de los Andes Arqueología.,Universidad de los Andes. Bogotá. http://curlinea.uniandes.edu.co/arqueo/genesis.htm,Arqueología Colombiana
5510,"Langebaek, Carl Henrik",1995,"From hunters and gatherers to Muisca, campesinos and hacendados in the Eastern highlands of Colombia -An archaeological survey in the Valles of Fúquene and Susa (1).","PhD Dissertation University of Pittsburgh. University of Pittsburgh Memoirs in Latin American Archaeology No 9. Pittsburgh - Bogotá: University of Pittsburgh, Department of Anthropology - Universidad de los Andes, Departamento de Antropología.",Arqueología Colombiana
9125,"Langebaek, Carl Henrik",2002,Geografía y pasado prehispánico: la formación de una nación.,"El nuevo mundo. Problemas y debates, eds., Bonnett y F. Castañeda, pp. 323-338. Bogotá: Universidad de los Andes.",Arqueología Colombiana
9090,"Langebaek, Carl Henrik",1994,Dieta y desarrollos prehispánicos en Colombia. Durante diez mil años el indígena presentó resistencia a la agricultura.,"Credencial Historia, 060: 4-7.",Arqueología Colombiana
4853,"Langebaek, Carl Henrik",1997,¿Quien vive aqui? Vivienda y cambio social en Colombia prehispanica: un ensayo preliminar.,"Nuevas memorias sobre las antigüedades Neogranadinas o de la cronología en la arqueología colombiana y otros asuntos, eds., Santiago Mora & Franz Flórez, pp 73-97. Colciencias, Editorial Guadalupe.",Arqueología Colombiana
9109,"Langebaek, Carl Henrik",1991,"Documenting the emergence of chiefdoms in the Muisca territory: a regional survey in the Fuquene Valley, Colombia.",Pittsburgh: University of Pittsburgh. Ms. 19 pgs.,Arqueología Colombiana
5212,"Langebaek, Carl Henrik",1988,Desarrollo de las comunidades indígenas de la sierra Nevada de Santa Marta desde el formativo hasta el siglo XVI.,Arqueología. Revista de estudiantes de Antropología. Universidad Nacional de Colombia 6(2):3-17.,Arqueología Colombiana
6308,"Langebaek, Carl Henrik",1987,Relaciones de los desarrollos del área Tairona y el intercambio.,"Boletín de Arqueología, 2(2):32-41.",Arqueología Colombiana
9085,"Langebaek, Carl Henrik",2004,Discursos coloniales sobre la idolatría en la Sierra Nevada de Santa Marta: el llanto sagrado de Fray Francisco Romero y el documento inédito de Melchor de Espinosa.,"El nuevo mundo. Problemas y debates, eds., D. Bonnett y F. Castañeda, pp. 243-277. Bogotá: Universidad de los Andes",Arqueología Colombiana
36368,"Langebaek, Carl Henrik",1985,Cuando los muiscas diversificaron Ia agricultura y crearon el intercambio.,"Boletfn Cultural y Bibliografico. 3, Volumen XXII:1-6",Arqueología Colombiana
9097,"Langebaek, Carl Henrik",1996,"Los caminos aborígenes.Caminos, mercaderes y cacicazgos: circuitos de comunicación antes de la invasión española en Colombia.","Caminos Reales de Colombia, ed., M. Useche, pp, 35-45. Fondo FEN Colombia.",Arqueología Colombiana
9124,"Langebaek, Carl Henrik",1999,Gerardo Reichel-Dolmatoff. Forjador de la antropología colombiana.,"Credencial Historia, 113: 12.",Arqueología Colombiana
5936,"Langebaek, Carl Henrik",1986,"Los períodos agroalfareros del altiplano Cundiboyacense vistos desde El Muelle, Sopó Cundinamarca.","Revista de Antropología Universidad de los Andes, 2(1-2): 127-142.",Arqueología Colombiana
9106,"Langebaek, Carl Henrik",1998,Los Andes y el Oriente: un caso de construcción colonial en los Andes del norte de Colombia.,"Intercambio y comercio entre costa, Andes y selva, eds., F. Cárdenas y T. Bray, pp. 13-29. Bogotá: Departamento de Antropología, Universidad de los Andes.",Arqueología Colombiana
8858,"Langebaek, Carl Henrik",2005,De los Alpes a las selvas y montañas de Colombia: el legado de Gerardo Reichel-Dolmatoff.,"Antipoda, 1:140-171.",Arqueología Colombiana
9116,"Langebaek, Carl Henrik",2006,"De las palabras, las cosas y los recuerdos: el Infiernito, la arqueología, los documentos y la etnología en el estudio de la sociedad muisca.","Contra la tiranía tipológica en arqueología: una visión desde Suramérica, eds., C. Gnecco & C. Langebaek, pp. 215-256. Bogotá: Uniandes – Ceso",Arqueología Colombiana
35876,"Langebaek, Carl Henrik",2006,"De las palabras, las cosas y los recuerdos: el infiernito, la arqueología, los documentos y la etnología en el estudio de la sociedad Muisca","Contra la tiranía tipológica en arqueología: una visión desde Suraméric,  eds., C. Gnecco & C. Langebaek, pp. 191-214. Bogotá: Uniandes - Ceso.",Arqueología Colombiana
9103,"Langebaek, Carl Henrik",1995,Heterogeneidad vs homogeneidad en la arqueología colombiana: una nota critica y el ejemplo de la orfebrería Muisca.,"Revista de Antropología y Arqueología, Universidad de los Andes, 11: 3-36.",Arqueología Colombiana
5545,"Langebaek, Carl Henrik",1995,Heterogeneidad vs. homogeneidad en la arqueología colombiana: una nota crítica y el ejemplo de la orfebrería colombiana.,"Revista de Antropología Universidad de los Andes, 11:3-36.",Arqueología Colombiana
5546,"Langebaek, Carl Henrik",1992,"Highland center and foothill periphery in 16th century, eastern Colombia.","Resarch in Economic Anthropology, 13:325-344.",Arqueología Colombiana
9104,"Langebaek, Carl Henrik",1995,De cómo convertir a los indios y de por qué no lo han sido. Juan de Varcalcel y la idolatría en el altiplano cundiboyacense a finales del siglo XVII.,"Revista de Antropología y Arqueología, Universidad de los Andes, 11: 187-214.",Arqueología Colombiana
9089,"Langebaek, Carl Henrik",2003,"Comportamiento, agencia y arqueología: un debate no resuelto.","Boletín de la Sociedad Colombiana de Psicología, Junio: 16-18.",Arqueología Colombiana
9119,"Langebaek, Carl Henrik",2000,Recientes investigaciones etnohistóricas y arqueológicas sobre la evolución de cacicazgos muiscas. El caso de los Valles de Fúquene y Susa.,Sociedades complejas en la Sabana de Bogotá. Siglos VIII al XVI d.C. Volumen III. Compiladoras M. Therrien & B. Enciso. Pp. 59-76. Bogotá: Instituto Colombiano de Antropología e Historia - Ministerio de Cultura.,Arqueología Colombiana
4894,"Langebaek, Carl Henrik",1990,Aguilas y caricuries. Venezuela y su coparticipación en el área orfebre de Colombia y el istmo en el siglo XVI.,"Revista Colombiana de Antropología, 27:199-235.",Arqueología Colombiana
6300,"Langebaek, Carl Henrik",1995,Regional archaeology in the Muisca territory. A study of the Fúquene and Susa Valleys.,"University of Pittsburgh, Departmente of Anthropology, PhD. Tesis.",Arqueología Colombiana
5331,"Langebaek, Carl Henrik",1991,El uso de adornos de metal y la existencia de sociedades complejas: una visión desde centro y suramérica.,"Revista de Antropología Universidad de los Andes, 7(1-2):73-90.",Arqueología Colombiana
5126,"Langebaek, Carl Henrik",1993,Arte precolombino-culturas.,"Gran Enciclipedia de Colombia. Tomo 6, pp. 27-42. Circulo de Lectores, Bogotá.",Arqueología Colombiana
35879,"Langebaek, Carl Henrik",2008,La ambigüedad de la diferencia: liberales y conservadores en la conformación de la antropología y la arqueología colombianas,"Arqueología en Latinoamérica: historias, formación académica y perspectivas temáticas, ed., Luis Gonzalo Jaramillo pp 85-108.Universidad de los Andes, Centro de Estudios Socioculturales e Internacionales – CESO",Arqueología Colombiana
6027,"Langebaek, Carl Henrik",1985,Notas históricas sobre los artefactos de origen Europeo en el área de la cultura Tairona.,"Revista de Antropología Universidad de los Andes, 1:80-84.",Arqueología Colombiana
9091,"Langebaek, Carl Henrik",1996,Caminos del Piedemonte Oriental: sistemas de comunicación prehispánica entre los Andes orientales y el piedemonte llanero.,"Caminos Reales de Colombia, ed., M. Useche, pp, 35-45.Fondo FEN Colombia.",Arqueología Colombiana
6028,"Langebaek, Carl Henrik",1986,Notas sobre el acceso a plantíos de coca en territorio Muisca siglo XVI.,Texto y Contexto 9:79-89.,Arqueología Colombiana
5981,"Langebaek, Carl Henrik",1985,"Mercados y circulación de productos en el altiplano Cundiboyacense: contribución al estudio de la economía, poblamiento y organización social Muisca.","Tesis de Grado Universidad de Los Andes (Inédito), Bogotá.",Arqueología Colombiana
6030,"Langebaek, Carl Henrik",1984,Notas sobre el intercambio y la especialización entre los Muiscas.,"Universidad de los Andes (Inédito), Bogotá.",Arqueología Colombiana
6031,"Langebaek, Carl Henrik",1985,"Notas sobre El Muelle, un sitio arqueológico en cercanías a Sopó, Cundinamarca.","Universidad de los Andes (Inédito), Bogotá.",Arqueología Colombiana
6033,"Langebaek, Carl Henrik",1992,Noticias de Caciques muy mayores. Origen y desarrollo de las sociedades complejas en el Nororiente de Colombia y Norte de Venezuela.,Ediciones Uniandes/Editorial Universidad de Antioquia.,Arqueología Colombiana
6148,"Langebaek, Carl Henrik",1999,Pre-columbian metallurgy and social change - Two case studies from Colombia.,"Archaeology in Latin America, ed., G.C. Politis & B. Alberti, pp 244-270. Routlege, London.",Arqueología Colombiana
9112,"Langebaek, Carl Henrik",1992,La Colombia indígena del siglo XVI.,"Credencial Historia, 033: 4-7.",Arqueología Colombiana
9102,"Langebaek, Carl Henrik",1996,La arqueología después de la arqueología en Colombia.,Dos lecturas críticas. Arqueología en Colombia. Pp. 9-42. Fondo de Promoción de la Cultura del Banco Popular.,Arqueología Colombiana
9164,"Langebaek, Carl Henrik",2006,Arqueología e izquierda en Colombia.,"Arqueología de la Represión y la resiencia en América Latina 1960-1980 eds., Pedro paulo A. Funari y Andrés Zaranquín pp 103-121. Córdoba: Universidad Nacional de Catamarta.",Arqueología Colombiana
6134,"Langebaek, Carl Henrik",1986,Plantíos de coca en territorio Muisca.,Texto y Contexto 9:79-89.,Arqueología Colombiana
5024,"Langebaek, Carl Henrik",1996,"Arqueología de nosotros mismos. Ocupaciones humanas y deterioro ambiental en los alrededores de la laguna de Fúquene, Colombia.","Integración, ciencias y tecnología, 1(3):71-80.",Arqueología Colombiana
5354,"Langebaek, Carl Henrik",1988,Entierros prehispánicos en viviendas: un ensayo de interpretación.,"Boletín de Arqueología, 3(2):3-10.",Arqueología Colombiana
6094,"Langebaek, Carl Henrik",1999,Pasado con función de hoy.,"Lecturas Dominicales de El Tiempo, pp. 8. Junio 27. Bogotá.",Arqueología Colombiana
9165,"Langebaek, Carl Henrik",2006,Pasado indígena en la costa Caribe. Interpretación en cinco actos.,El caribe en la Nación colombiana editado por Alberto Abello 2006: 38-66. Museo nacional de Colombia.,Arqueología Colombiana
5006,"Langebaek, Carl Henrik",2003,"Arqueología colombiana. Ciencia, pasado y exclusión.",Colección Colombiana. Ciencia y tecnología. Colciencias.,Arqueología Colombiana
6100,"Langebaek, Carl Henrik",1990,Patologías de la población Muisca y la hipótesis de la economía autosuficiente.,"Revista de Antropología Universidad de los Andes, 4(1):141-157.",Arqueología Colombiana
9111,"Langebaek, Carl Henrik",2001,Patrimonio arqueológico e investigación en el nuevo Museo Nacional de Colombia.,"La arqueología, la etnografía, la historia y el arte en el Museo, pp. 89-97. Bogotá: Ministerio Cultural - Museo Nacional de Colombia.",Arqueología Colombiana
6114,"Langebaek, Carl Henrik",1996,Patterns of human mobility and elite finances in 16Th century northern Colombia and western Venezuela.,"Chieftains, power & trade: regional interaction in the intermediate area of the americas, eds., Carl Langebaek & Felipe Cardenas. pp 155-174. Universidad de Los Andes.",Arqueología Colombiana
6113,"Langebaek, Carl Henrik",1998,Patterns of coca consumption in the Intermediate Area north of Ecuador: a review of the evidence.,"Acta Americana, 6(1):51-77",Arqueología Colombiana
5108,"Langebaek, Carl Henrik",2001,Arqueología regional en el Valle de Leiva: procesos de ocupación humana en una región de los Andes orientales de Colombia.,Informes Arqueológicos del Instituto Colombiano de Antropología e Historia. 2. Bogotá.,Arqueología Colombiana
9123,"Langebaek, Carl Henrik",2004,El origen de un país. Caciques e indios.,"Semana, 1152: 46, 48. mayo 31.",Arqueología Colombiana
9107,"Langebaek, Carl Henrik",1998,Indígenas de hoy y de ayer.,"Nueva Historia de Colombia, Vol. IX: 101-127. Bogotá: Planeta.",Arqueología Colombiana
5752,"Langebaek, Carl Henrik",1987,"La cronología de la región arqueológica Tairona vista desde Papare, municipio de Ciénaga.","Boletín de Arqueología, 2(1):83-101.",Arqueología Colombiana
9100,"Langebaek, Carl Henrik",1998,Propuesta para un estudio regional del Valle de Leiva 1999-2000.,Proyecto de investigación. Universidad de los Andes. Bogotá.,Arqueología Colombiana
5199,"Langebaek, Carl Henrik",2000,"Cacicazgos, orfebería y poltica preshispánica: una perspectiva desde Colombia.","Revista de Arqueología del Área Intermedia, 2:11-45",Arqueología Colombiana
5597,"Langebaek, Carl Henrik",1995,Informe preliminar sobre actividades del proyecto Tierradentro.,"Revista de Antropología Universidad de los Andes, 11:226-236.",Arqueología Colombiana
9088,"Langebaek, Carl Henrik",2002,Antecedentes indígenas del urbanismo colonial en dos regiones de Colombia: los andes orientales y el Valle de Aburrá. Una visión desde la arqueología.,"Revista de Estudios Sociales, 11: 47-56. Universidad de los Andes.",Arqueología Colombiana
9096,"Langebaek, Carl Henrik",2004,El inicio de una historia. Los primeros pobladores.,"Semana, 1152: 44-45. mayo 31. http://colombiamania.com/historia/index_historia/01_colombia_precolombina/0006_colombia_paleo_india.html",Arqueología Colombiana
5982,"Langebaek, Carl Henrik",1987,"Mercados, poblamiento e interación étnica entre los Muisca.","Colección bibliográfica, Banco de la República. Bogotá.",Arqueología Colombiana
5194,"Langebaek, Carl Henrik",1990,Buscando sacerdotes y encontrando chuques: de la organización religiosa Muisca.,"Revista de Antropología Universidad de los Andes, 4(1):79-103.",Arqueología Colombiana
9086,"Langebaek, Carl Henrik",2005,Arqueología colombiana:balance y retos.,"Arqueología Suramericana, 1 (1): 96-114.",Arqueología Colombiana
9110,"Langebaek, Carl Henrik",2000,"Cacicazgos, orfebrería y política prehispánica: una perspectiva desde Colombia.","Arqueología del Área Intermedia, 2: 11-45.",Arqueología Colombiana
5773,"Langebaek, Carl Henrik",1994,"La elite no siempre piensa lo mismo. Indígenas, estado, arqueología y etnohistoria en Colombia (Siglos XVI a inicios del XX).","Revista Colombiana de Antropología, 31:121-143",Arqueología Colombiana
5303,"Langebaek, Carl Henrik",1992,El oro y las culturas precolombinas.,Compañia Litográfica Nacional S.A.,Arqueología Colombiana
5770,"Langebaek, Carl Henrik",1999,La economía política de la orfebrería colombiana.,"Ponencia presentada a : I Congreso de arqueología en Colombia: La Arqueología Colombiana Ante los Nuevos Paradigmas del Siglo XXI. Sociedad Colombiana de Arqueología - Universidad de Caldas Manizales, 28 al 30 de octubre de 1999.",Arqueología Colombiana
9105,"Langebaek, Carl Henrik",1991,"Mindalaes, balsas y la relevancia del imperialismo Inca en el sur de Colombia.","Cespedesia, 18 (61): 73-92.",Arqueología Colombiana
5764,"Langebaek, Carl Henrik",1989,La descripción de la provincia del Darien en 1763 por Antonio de Arevalo.,"Boletín de Arqueología, 4(1):41-50.",Arqueología Colombiana
8859,"Langebaek, Carl Henrik",2001,Resistencia indígena y transformaciones ideológicas entre los muiscas de los siglos xvi y xvii.,"Concepciones de la conquista. Aproximaciones interdisciplinarias, Eds, Felipe Castañeda y Matthias Vollet, pp. 281-330, Bogotá, Universidad de los Andes.",Arqueología Colombiana
6183,"Langebaek, Carl Henrik",1985,Producción agrícola y desarrollo sociopolítico entre los Chibchas de la serranía de Mérida y la cordillera oriental de Colombia Siglo XVI.,Ponencia Presentada al 45 Congreso Internacional de Americanistas. Bogotá,Arqueología Colombiana
9117,"Langebaek, Carl Henrik",2007,Más allá de la región: ensayo de análisis demográfico antes y después de la Conquista española en Colombia.,"Escalas menores - escalas mayores. Una perspectiva arqueológica desde Colombia y Panamá, ed, L. Jaramillo, pp. 109-120. Bogotá: Uniandes - Ceso.",Arqueología Colombiana
9108,"Langebaek, Carl Henrik",1998,Propuesta técnica y económica para la fase de rescate y monitoreo arqueológico de la Línea A 220 KV Sabanalarga - Nueva Barranquilla. ISA Interconexión eléctrica S.A. E.S.P.,Bogotá: Universidad de los Andes. Ms. 18 pgs.,Arqueología Colombiana
9087,"Langebaek, Carl Henrik",2003,The political economy of pre-columbia goldwork: four examples from northern South America.,"Gold and power in ancient Costa Rica, Panama, and Colombia, eds., J. Quilter & J. W: Hoopes, pp. 245-278. Washington: Dumbarton Oaks",Arqueología Colombiana
8882,"Langebaek, Carl Henrik",2004,Secuencias y procesos. Estudio comparativo del desarrollo de jerarquías de asentamiento prehispánicas en el norte de Suramérica.,"Revista de Arqueología del Área Intermedia, 6:199-248.",Arqueología Colombiana
6461,"Langebaek, Carl Henrik",1987,Supervivencia de practicas de orfebreria en el territorio muisca durante el siglo XVI; el caso de Lenguazaque.,"Universitas Humanistica, Universidad Javeriana 16(26):45-52.",Arqueología Colombiana
6527,"Langebaek, Carl Henrik",1998,Tierradentro: 2000 años de historia en una región del sur de Colombia.,"Ed., C. Langebaek. Bogotá: Universidad de los Andes - Instituto Colombiano de Antropología. Ms. Inédito.",Arqueología Colombiana
6541,"Langebaek, Carl Henrik",1987,Tres formas de acceso a recursos en territorio de la Confederación del Cocuy siglo XVI.,"Boletín del Museo del Oro, 18:28-45.",Arqueología Colombiana
8916,"Langebaek, Carl Henrik",2003,Teorías en la práctica de la arqueología en Colombia(2).,Revista de Estudiantes de Arqueología 1:37-48. Facultad de Ciencias Humanas. Universidad Nacional de Colombia.,Arqueología Colombiana
9113,"Langebaek, Carl Henrik",1992,Siempre hay más de un camino... Dos sociedades complejas: Incas y Muiscas.,"Crónicas del Nuevo Mundo, 04: 50-64. Bogotá: CINEP - El Colombiano - ICAN",Arqueología Colombiana
6420,"Langebaek, Carl Henrik",1988,"Santuarios indígenas en el repartimiento de Iguaque, Boyáca. Un documento de 1595 del Archivo Histórico Nacional de Colombia (transcripción).","Revista  de Antropología Universidad de Los Andes, 4(2):215-250.",Arqueología Colombiana
6445,"Langebaek, Carl Henrik",1994,"Social conflict and environmental degradation in the valle de Fuquene, Eastern highlands, Colombia: an archaeological perspective.","Paper presented at the symposium ""Threatened Peoples and environments in the Americas"" 48th International Congress of Americanist, Stockolm/Uppsala, Sweden, July 4-9.",Arqueología Colombiana
9118,"Langebaek, Carl Henrik & Alejandro Dever",2002,Arqueología en el Bajo Magdalena: un modelo de poblamiento para los primeros agricultores del Caribe Colombiano.,Arqueología en estudios de impacto ambiental. Volumen 3. PP. 17-38. Bogotá: ISA.,Arqueología Colombiana
501,"Langebaek, Carl Henrik & Alejandro Dever",2000,Arqueología en el bajo Magdalena: un estudio de los primeros agricultores del caribe colombiano.,Informes Arqueológicos del Instituto Colombiano de Antropología e Historia. 1. Bogotá.,Arqueología Colombiana
9120,"Langebaek, Carl Henrik & Alejandro Dever",2002,"Estudio regional en las bahías del Parque Tayrona: arqueología, medio ambiente y desarrollo de sociedades complejas.","Boletín de Arqueología, 17 (1): 2-16.",Arqueología Colombiana
9121,"Langebaek, Carl Henrik & Carlo Emilio Piazzini",2003,Procesos de poblamiento en Yacuanquer-Nariño: una investigación arqueológica sobre la microverticalidad en los Andes colombianos (siglos X a XVIII d.C.).,Bogotá: ISA.,Arqueología Colombiana
9128,"Langebaek, Carl Henrik & Carlo Emilio Piazzini & Alejandro Dever",2003,"Respuesta a la reseña sobre ""Arqueología y guerra en el Valle de Aburrá: estudio de cambios sociales en una región del noroccidente de Colombia"".","Revista de Antropología y Arqueología, Universidad de los Andes,  14: 211-221.",Arqueología Colombiana
5425,"Langebaek, Carl Henrik & Hildur, Zea",1983,Excavaciones arqueológicas en el Muelle II (Municipio de Sopó).,"Semestre de Campo, Universidad de los Andes (Inédito), Bogotá.",Arqueología Colombiana
5977,"Langebaek, Carl Henrik, Andrea Cuellar y Alejandro Dever",1998,Medio ambiente y poblamiento en la Guajira: investigaciones arqueológicas en el ranchería medio.,Bogotá: Universidad de los Andes - Dpto. de Antropología.,Arqueología Colombiana
5114,"Langebaek, Carl Henrik, Emilio Piazzini, Alejandro Dever, Iván Espinosa.",2002,Arqueología y guerra en el valle de Aburrá: Estudio fr cambios sociales en unaregión del noroccidente de Colombia.,Ediciones Uniandes.,Arqueología Colombiana
9122,"Langebaek, Carl Henrik, Santiago Giraldo; Alejandro Bernal; Silvia Monroy; Andrés Barragán & Jorge Morales",2000,Por los caminos del piedemonte: Una historia de los andes orientales y los llanos entre los siglos XVI - XIX.,Bogotá: Universidad de los Andes.,Arqueología Colombiana
5976,"Langebaek, Carl Henrik; Andrea Cuellar y Alejandro Dever",1998,Medio ambiente y poblamiento en la Guajira: Investigaciones arqueológicas em el Ranchería medio.,Estudios Arqueológicos 1. Departamento de Antropología. Universidad de Los Andes,Arqueología Colombiana
36131,"Langebaek, Carl Henrik; Dever, Alejandro",2009,"Arqueología regional en Tierradentro, Cauca, Colombia","Revista Colombiana de Antropología, 45(2):323-367.",Arqueología Colombiana
5113,"Langebaek, Carl Henrik; Emilio Piazzini, Alejandro Dever e Iván Espinosa",2002,Arqueología y guerra en el Valle de Aburrá: estudio de cambios sociales en una región del noroccidente de Colombia.,Bogotá: UNIANDES.,Arqueología Colombiana
6056,"Lathrap, Donald W, John S. Isaacson & Colin McEwan",1984,On the trail of the finest metallurgy of the ancient new world: how old is the classic Quimbaya style?,"Field Museum of Natural History, 55(10):11-19.",Arqueología Colombiana
