Año,Autor,Título,Publicado,Sitios,Etapa,Región
1983,"Langebaek, Carl & Hildur, Zea","Excavaciones arqueológicas en el Muelle II (Municipio de Sopó).","","","Cacicazgos","Altiplano Cundiboyacense"
1983,"Illera, Carlos","Excavaciones arqueológicas en Guabas-Guacarí- valle del Cauca.","","","Cacicazgos","Valles alto Calima y alto y medio del Cauca"
1983,"Herrera, Leonor; Marianne, Cardale & Warwick, Bray","El hombre y su medio ambiente en Calima (Altos ríos Calima y río grande, cordillera Occidental).","","Varsovia","Cacicazgos","Valles alto Calima y alto y medio del Cauca"
1983,"Hassler, Juan A.","Erótica de Tumaco y análogas, descifradas.","","","Cacicazgos","Costa Pacífica"
1983,"Gähwiler-Walder, Theres","Preliminary reconnaissance in the Pavas-La Cumbre area.","","La Sofía Bitaco; Ocache; Purilia","Cacicazgos","Valles alto Calima y alto y medio del Cauca"
1983,"Gutierrez, Sylvia & Lieselotte de García","Vacío prehistórico en la sabana de Bogotá.","","","","Altiplano Cundiboyacense"
1983,"Groot, Ana María","Ciudad Perdida: una población serrana de los Taironas.","","","Cacicazgos","Sierra Nevada"
1983,"Díaz, Carmenza","Contribución al estudio del poblamiento Panche.","","","Cacicazgos","Magdalena medio"
1983,"Duque, Luís & Julio César, Cubillos","Arqueología de San Agustín: exploraciones y trabajos de reconstrucción en las Mesitas A y B.","","","Cacicazgos","Alto Magdalena"
1983,"Cárdenas, Felipe","Los cacicazgos Taironas: un acercamiento arqueológico y etnohistórico.","","","Cacicazgos","Sierra Nevada"
1983,"Correal, Gonzalo & María Pinto","Investigaciones arqueológicas en el municipio de Zipacón, Cundinamarca.","","","Paleoindio","Altiplano Cundiboyacense"
1983,"Casasbuena, Gullermo & Myriam Espinoza","Asentamientos prehispánicos en el Alto Sinú.","","","Cacicazgos","Uraba, alto Sinú"
1983,"Cardale,  Marianne","Textiles arqueológicos en el museo Casa de Bolívar, Bucaramanga.","","","Cacicazgos","Montaña Santandereana"
1983,"Bray, Warwick; Leonor Herrera & Marianne Cardale","Report on the 1981 field season in Calima.","","","Cacicazgos","Valles alto Calima y alto y medio del Cauca"
1983,"Botiva, Alvaro","El desarrollo industrial y el patrimonio arqueológico nacional.","","","",""
1983,"Botiva, Alvaro","Rescate de restos arqueológicos.","","","",""
1983,"Botiva, Alvaro","Rescate de restos arqueológicos. Cartilla de instrucciones.","","","",""
1983,"Bischof, Henning","Indígenas y españoles en la sierra nevada de Santa Marta - Siglo XVI.","","","Cacicazgos","Sierra Nevada"
1983,"Barney Cabrera, Eugenio","Calima, El Dorado prehispánico .","","","Cacicazgos","Valles alto Calima y alto y medio del Cauca"
1983,"Barney Cabrera, Eugenio","El arte y artesanias de los Chibchas.","","","Cacicazgos","Altiplano Cundiboyacense"
1983,"Barney Cabrera, Eugenio","El universo del mito.","","","",""
1983,"Barney Cabrera, Eugenio","Expresiones del arte Calima .","","","Cacicazgos","Valles alto Calima y alto y medio del Cauca"
1983,"Barney Cabrera, Eugenio","La cultura del maíz y la sal.","","","Cacicazgos",""
1983,"Barney Cabrera, Eugenio","La geometría del oro en el Tolima.","","","Cacicazgos","Magdalena medio"
1983,"Barney Cabrera, Eugenio","Las culturas Andinas del sur.","","","Cacicazgos","Macizo Andino del sur"
1983,"Barney Cabrera, Eugenio","Las culturas de la llanura Atlántica.","","","Cacicazgos","Llanuras del Caribe cuencas bajas Sinú y San Jorge"
1983,"Barney Cabrera, Eugenio","Los Quimbayas, ceramistas y orfebres.","","","Cacicazgos","Valles alto Calima y alto y medio del Cauca"
1983,"Barney Cabrera, Eugenio","Prehistoria del arte indígena.","","","",""
1983,"Barney Cabrera, Eugenio","San Agustín, centro religioso y artistico.","","","Cacicazgos","Alto Magdalena"
1983,"Barney Cabrera, Eugenio","San Agustín, un pueblo de escultores.","","","Cacicazgos","Alto Magdalena"
1983,"Barney Cabrera, Eugenio","Tumaco, abstracción y realismos.","","","Cacicazgos","Costa Pacífica"
1983,"Barney Cabrera, Eugenio","Tumaco, escultura en arcilla.","","","Cacicazgos","Costa Pacífica"
1983,"Ayala. Leonardo","Las tumbas pintadas de Tierradentro.","","","Cacicazgos","Alto Magdalena"
1983,"Ayala, Leonardo & Pablo Gamboa","Los artifices de la sierra y el mar.","","","Cacicazgos","Sierra Nevada"
1983,"Ardila, Gerardo","Arqueología de rescate. Proyecto carbonífero de El Cerrejón. Zona norte. Area de El Palmar.","","El Palmar","Cacicazgos","Peninsula de la Guajira y corredor del Cesar"
1983,"Angulo, Carlos","Arqueología del valle de Santiago, norte de Colombia.","","San Juan; María Jacinta;","Cacicazgos","Llanuras del Caribe cuencas bajas Sinú y San Jorge"
1983,"Andrade, Angela","Estudio arqueológico de los antrosoles de Araracuara (Amazonas).","","","Cacicazgos","Tierras bajas orientales"
1982,"Vivas, L","Investigaciones arqueológicas en el sitio de Pueblillo, Yanaconas, Cauca.","","","Cacicazgos","Alto Magdalena"
1982,"Tovar, Arnold","Análisis y síntesis de la arqueología en el Tolima.","","","Cacicazgos","Magdalena medio"
1982,"Torres, Reina","Panorama arqueológico del Darien.","","","Cacicazgos","Uraba, alto Sinú"
1982,"Soto, Alvaro","Proyecto Buritaca 200 de Junio de 1976 a septiembre de 1982.","","","Cacicazgos","Sierra Nevada"
1982,"Patiño, Diógenes","Investigación arqueológica en la región del Patía, al nor-este del municipio de Mercaderes.","","","","Macizo Andino del sur"
1982,"Mora, Santiago & Elizabeth,  Marquez","Catanga: un sitio arqueológico de los Lllanos Colombianos.","","Catanga","Cacicazgos","Tierras bajas orientales"
1982,"Mora, Santiago & Elizabeth,  Marquez","Investigaciones arqueológicas en el municipio de Yopal, Casanare.","","Catanga","Cacicazgos","Tierras bajas orientales"
1982,"Lemus, Fernando","Investigaciones arqueológicas en la antigua provincia de Ocaña.","","","","Montaña Santandereana"
1982,"Legast, Anne","La fauna mitica Tairona","","","Cacicazgos","Sierra Nevada"
1982,"Gnecco, Cristóbal","Los árboles: un sitio en el valle de Popayán.","","","","Valles alto Calima y alto y medio del Cauca"
1982,"Gamboa, Pablo","La escultura en la sociedad agustiniana.","","","Cacicazgos","Alto Magdalena"
1982,"Cárdenas, Felipe","Excavaciones arqueológicas en la terraza y vivienda No 149 - A de Buritaca 200.","","","Cacicazgos","Sierra Nevada"
1982,"Correal, Gonzalo & María Pinto","Investigaciones arqueológicas en el municipio de Zipacon Cundinamarca (1).","","Zipacon","Paleoindio","Altiplano Cundiboyacense"
1982,"Casilimas, Inés & María, López","Etnohistoria Muisca: De los Jeques a los doctrineros.","","","Cacicazgos","Altiplano Cundiboyacense"
1982,"Cardale, Marianne","La colina de la sal Zipaquirá, patrones de asentamiento durante la época precolombina y la colonia.","","","Cacicazgos","Altiplano Cundiboyacense"
1982,"Bouchard, Jean-François","Excavaciones arqueológicas en la región de Tumaco, Nariño, Colombia.","","","Cacicazgos","Costa Pacífica"
1982,"Botiva, Alvaro","Arqueología de rescate en cercanías de Neiva.","","","Cacicazgos","Alto Magdalena"
1982,"Botiva, Alvaro","Arqueología. Apéndice técnico. Proyecto carbonífero de El Cerrejón.","","","","Peninsula de la Guajira y corredor del Cesar"
1982,"Botiva, Alvaro","Fundamentos para un programa de investigación y rescate arqueológico prehispánico en el área del proyecto carbonifero.","","","Cacicazgos","Peninsula de la Guajira y corredor del Cesar"
1982,"Botiva, Alvaro","Reseña a Segunda campaña de investigaciones arqueológicas y prehistóricas en la región del Golfo de Urabá.","","","Cacicazgos","Uraba, alto Sinú"
1982,"Boada, Ana María & María Cristina Hoyos","Investigaciones arqueológicas en un anillo de vivienda en frontera (Sierra Nevada de Santa Marta).","","","Cacicazgos","Sierra Nevada"
1982,"Baquero, Alvaro","Algunas consideraciones sobre el estado de la investigación arqueológica de la Orinoquia Colombiana.","","","Cacicazgos","Tierras bajas orientales"
1982,"Adames, Amparo","Glosario de terminología técnica de cerámica arqueológica para Colombia.","","","",""
1981,"Villamarín Juan & Villamarín, Judith","Parentesco y herencia entre los Chibchas de la Sabana de Bogotá al tiempo de la conquista española.","","","Cacicazgos","Altiplano Cundiboyacense"
1981,"Uribe, María Victoria","Reconocimiento arqueológico del valle medio del río Guamués (Putumayo).","","Guam I, II, III.","","Tierras bajas orientales"
1981,"Silva, Eliécer","Investigaciones arqueológicas en Villa de Leyva.","","El Infiernito","Cacicazgos","Altiplano Cundiboyacense"
1981,"Shuler-Schomig, Von  Immina","A grave lot of the Sonso period.","","","Cacicazgos","Valles alto Calima y alto y medio del Cauca"
1981,"Scott, David","Metallurgical studies of Calima ornaments.","","La Suiza","Cacicazgos","Valles alto Calima y alto y medio del Cauca"
1981,"Rojas, Argemiro","Pacho: antiguo poblado indígena.","","","Cacicazgos","Altiplano Cundiboyacense"
1981,"Puerta, Mauricio","Investigaciones arqueológicas en Tierradentro ( Inza, Turminá, Mosoco).","","","Cacicazgos","Alto Magdalena"
1981,"Plazas, Clemencia & Ana María Falchetti","Asentamientos prehispánicos en el bajo río San Jorge.","","Japón 3; Guaiqurí","Cacicazgos","Llanuras del Caribe cuencas bajas Sinú y San Jorge"
1981,"Plazas, Clemencia & Ana María Falchetti","El legendario Zenu","","","Cacicazgos","Llanuras del Caribe cuencas bajas Sinú y San Jorge"
1981,"Llanos, Héctor","Los cacicazgos de Popayán a la llegada de los conquistadores.","","","Cacicazgos","Alto Magdalena"
1981,"Herrera, Leonor, Warwick, Bray & Colin McEwan","Datos sobre la arqueología de Araracuara (Comisaria del Amazonas, Colombia).","","Araracuara 21, 22, 15, 7","Cacicazgos","Tierras bajas orientales"
1981,"Herrera, Leonor","Relaciones entre ocupaciones prehispánicas y suelos negros en la cuenca del río Caquetá en Colombia.","","","Cacicazgos","Tierras bajas orientales"
1981,"Galarza, Martha","La deformación craneal artificial en Colombia.","","","Cacicazgos",""
1981,"Echeverría, José & María Victoria Uribe","Papel del Valle de Chota-Mira en la economia interandina de los Andes septentrionales del Ecuador.","","","Cacicazgos","Macizo Andino del sur"
1981,"Duque, Luís & Julio César, Cubillos","Arqueología de San Agustín: La Estación.","","La Estación","Cacicazgos","Alto Magdalena"
1981,"Cubillos, Julio César","Arqueología del valle del Cauca. Asentamientos prehispánicos en suela plana del río Cauca.","","","Cacicazgos","Valles alto Calima y alto y medio del Cauca"
1981,"Correal, Gonzalo","Evidencias culturales y megafauna pleistocenica en Colombia.","","","Paleoindio","Altiplano Cundiboyacense"
1981,"Correal, Gonzalo","Investigaciones arqueológicas en Tibito. Evidencias culturales asociadas a megafauna durante el pleistoceno tardío en Colombia.","","Tibito","Paleoindio","Altiplano Cundiboyacense"
1981,"Chaves, Alvaro","Los animales mágicos de las urnas de Tierradentro.","","","Cacicazgos","Alto Magdalena"
1981,"Chaves, Alvaro","Los animales mágicos de Tierradentro.","","","Cacicazgos","Alto Magdalena"
1981,"Chaves, Alvaro & Mauricio, Puerta","Entierro y vivienda en Monserrate Huila.","","","Cacicazgos","Alto Magdalena"
1981,"Castillo, Neyla","Excavaciones arqueologicas en Tunja","","UPTC","Cacicazgos","Altiplano Cundiboyacense"
1981,"Castillo, Neyla","Excavaciones arqueologicas en Tunja (II)","","UPTC","Cacicazgos","Altiplano Cundiboyacense"
1981,"Castaño, Carlos","Dinámica y procesos de conformación en las  unidades sincrónicas del asentamiento de Buritaca 200.","","","Cacicazgos","Sierra Nevada"
1981,"Cardale, Marianne","Las salinas de Zipaquirá, su explotación indígena.","","","Cacicazgos","Altiplano Cundiboyacense"
1981,"Cardale, Marianne","Ocupaciones humanas en el altiplano Cundiboyacense. La etapa cerámica vista desde Zipaquirá.","","Zipaquira","Cacicazgos","Altiplano Cundiboyacense"
1981,"Bruhns, Karen","Prehispanic ridged fields of central Colombia.","","","Cacicazgos",""
1981,"Broadbent, Sylvia","The formation of peasant society in central Colombia.","","","Colonial","Altiplano Cundiboyacense"
1981,"Bray, Warwick; Leonor Herrera & Marianne Cardalel","Preliminary report on the 1980 field season.","","Montañitas, La Virginia, Tres Esquinas, La Iberia;","Cacicazgos","Valles alto Calima y alto y medio del Cauca"
1981,"Bray, Warwick; Leonor Herrera & Marianne Cardale","Report on the 1980 field season in Calima.","","La Virginia; Montañitas; La Iberia; Cortijo de los Calimas; Tres Esquinas; La Alsacia; La Aurora;","Cacicazgos","Valles alto Calima y alto y medio del Cauca"
1981,"Bray, Warwick","Problems of chronology.","","La Virginia; Montañitas","Cacicazgos","Valles alto Calima y alto y medio del Cauca"
1981,"Bouchard, Jean François","Las figurillas zoomorfas del litoral pacífico ecuatorial.","","","Cacicazgos","Costa Pacífica"
1981,"Botiva, Alvaro","Proyecto carbonífero de El Cerrejón - Estudio Ambiental. Fundamentos para un programa de investigación arqueológica y prehistórica en el área del Proyecto","","","","Peninsula de la Guajira y corredor del Cesar"
1981,"Botiva, Alvaro","Reconocimiento arqueológico del curso medio del río Ranchería.","","","Cacicazgos","Peninsula de la Guajira y corredor del Cesar"
1981,"Botiva, Alvaro","Rescate arqueológico en Campo Dina (Neiva - Huila).","","","","Alto Magdalena"
1981,"Ardila, Gerardo","Investigaciones arqueológicas en Chía (1)","","Chía I (La Mana), Chía II (Las Peñitas), Chía III (Las Peñitas).","Paleoindio","Altiplano Cundiboyacense"
1981,"Ardila, Gerardo","Investigaciones arqueológicas en Chía.","","","Paleoindio","Altiplano Cundiboyacense"
1981,"Angulo, Carlos","La tradición Malambo.","","Malambo, Los  Mangos","Cacicazgos","Llanuras del Caribe cuencas bajas Sinú y San Jorge"
1981,"Alcina Franch, José","Fechas radiocarbónicas en la Arqueología del Ecuador.","","","","Ecuador"
1980,"Tovar, Hermes","La formación social Chibcha.","","","Cacicazgos","Altiplano Cundiboyacense"
1980,"Tovar, Arnold","Investigaciones arqueológicas en el cañon de Amaime.","","","","Alto Magdalena"
1980,"Torres, Marcela","La fotointerpretación como instrumento moderno para la prospección arqueológica, un ejemplo práctico en la Sabana de Bogotá.","","","","Altiplano Cundiboyacense"
1980,"Scott, David","Cuentas de collar elaboradas en aleación de cobre procedente de Nariño, Colombia.","","","Cacicazgos","Macizo Andino del sur"
1980,"Santos, Gustavo et al.,","Asentamientos prehispánicos en la región del golfo de Urabá.","","","Cacicazgos","Uraba, alto Sinú"
1980,"Rodríguez, Darío","Consolidación de madera arqueológica.","","San Isidro","Cacicazgos",""
1980,"Plazas, Clemencia","Clasificación de objetos de orfebreria precolombiana segun su uso.","","","Cacicazgos",""
1980,"Mendez, Miguel","Hallazgos de elementos arcaicos durante una labor de salvamento.","","La Balsa","","Valles alto Calima y alto y medio del Cauca"
1980,"Legast, Anne","La fauna en la orfebreria Sinú.","","","Cacicazgos","Llanuras del Caribe cuencas bajas Sinú y San Jorge"
1980,"Illera, Carlos","Aportes teóricos a la revaluación del concepto de Cultura Calima.","","","Cacicazgos","Valles alto Calima y alto y medio del Cauca"
1980,"Herrera, Luisa Fernanda","Buritica 200: estudio de polen arqueológico.","","Buritica 200","Cacicazgos","Sierra Nevada"
1980,"Groot, Ana María","Buritica 200: una fecha de radio-carbón asociada con objetos de orfebreria Tairona.","","Buritica 200","Cacicazgos","Sierra Nevada"
1980,"Errazuriz, Jaime","Tumaco-La Tolita. Una cultura precolombina desconocida.","","","Cacicazgos","Costa Pacífica"
1980,"Dueñas, Hernando","Variaciones climáticas del pleistoceno superior y del holoceno en la Sabana de Bogotá (Estudio palinológico de la formación sabana).","","","","Altiplano Cundiboyacense"
1980,"Cubillos, Julio César","Arqueología de San Agustín: El Estrecho, El Parador y Mesita C.","","Mesita C, El Estrecho, El Parador","Cacicazgos","Alto Magdalena"
1980,"Correal, Gonzalo","Estado actual de las investigaciones sobre la etapa lítica en Colombia.","","Tequendama, Abra, Nemocón (4), Sueva (1), Gachalá.","Paleoindio","Altiplano Cundiboyacense"
1980,"Correal, Gonzalo","Una tumba de pozo con cámara lateral en el Municipio de Armenia.","","","Cacicazgos","Valles alto Calima y alto y medio del Cauca"
1980,"Chaves, Alvaro & Mauricio, Puerta","Entierros primarios de Tierradentro.","","","Cacicazgos","Alto Magdalena"
1980,"Cavelier, Inés","Reconocimiento arqueológico en el curso alto del río Güéjar.","","","Cacicazgos","Tierras bajas orientales"
1980,"Cardale, Marianne & Ana María Falchetti","Objetos prehispánicos de madera procedentes del Altiplano nariñense, Colombia.","","San Isidro-Guaitarilla","Cacicazgos","Macizo Andino del sur"
1980,"Cadavid, Gilberto & Ana María Groot","Buritaca 200.  Arqueología y conservación de una población precolombina. (Sierra Nevada de Santa Marta).","","","Cacicazgos","Sierra Nevada"
1980,"Bouchard, Jean François","Hilos de oro martillado hallados en la costa meridional de Colombia.","","","Cacicazgos","Costa Pacífica"
1980,"Ayala, Gloria & Sylvia Botero","Aponte: estudio etno-arqueológico del poblamiento de una comunidad viva.","","","",""
1980,"Ardila, Gerardo","El arcaico en el altiplano andino colombiano.","","Chía I","Formativo","Altiplano Cundiboyacense"
1980,"Anónimo","La tradición Malambo un complejo temprano en el noroeste de suramerica.","","Malambo, Los Mangos","Cacicazgos","Llanuras del Caribe cuencas bajas Sinú y San Jorge"
1980,"Andrade, Angela","Bases para la estructuración de estudios arqueológicos en la región de Santa Marta.","","","Cacicazgos","Sierra Nevada"
1979,"Villamarín Juan & Villamarín, Judith","Chibcha settlement under Spanish rule: 1537-1810.","","","Colonial","Altiplano Cundiboyacense"
1979,"Sutherland, Donald & N. Carson","Adaptaciones prehistóricas al ambiente litoral en la isla de Salamanca, costa norte de Colombia.","","","Cacicazgos","Llanuras del Caribe cuencas bajas Sinú y San Jorge"
1979,"Schultes, Richard & Alec Bright","Ancient Gold pectorals from Colombia: Mushroom effigies.","","","Cacicazgos",""
1979,"Romoli, Kathleen","Las tribus de la antigua jurisdicción de Pasto en el siglo XVI.","","","Colonial","Macizo Andino del sur"
1979,"Reines, Leon","Una contribución a la arqueología del bajo río Magdalena. Excavaciones en Guaiquirí.","","","","Llanuras del Caribe cuencas bajas Sinú y San Jorge"
1979,"Plazas, Clemencia; Ana María, Falchetti & Juanita Sáenz","Investigaciones arqueológicas en el río San Jorge","","Japón 1 y 3, El Anclar, Las palmas","Cacicazgos","Llanuras del Caribe cuencas bajas Sinú y San Jorge"
1979,"Perdomo, Lucía","Manual de arqueología colombiana.","","","",""
1979,"Legast, Anne","Identificación de la fauna representada en el material del área arqueológica Sinú.","","","Cacicazgos","Llanuras del Caribe cuencas bajas Sinú y San Jorge"
1979,"Hernández, Cecilia","Excavaciones arqueológicas en las vegas del Sabandija.","","","Cacicazgos","Magdalena medio"
1979,"Hernández de  Alba, Gregorio","La cultura arqueológica de San Agustín.","","","Cacicazgos","Alto Magdalena"
1979,"Helms, Mary","Ancient Panama. Chiefs in serach of power.","","","Cacicazgos",""
1979,"Helmes, Mary W","Anciente Panama. Chiefs in search of power.","","","Cacicazgos",""
1979,"Falchetti, Ana María","Colgantes Darien relaciones entre áreas orfebres del occidente colombiano y Centroamérica.","","","Cacicazgos","Llanuras del Caribe cuencas bajas Sinú y San Jorge"
1979,"Duran, Anabela","Quinchana: un sitio de asentamiento.","","Quinchana","Cacicazgos","Alto Magdalena"
1979,"Duque, Luís","El oro en las prácticas religiosas de los Muiscas.","","","Cacicazgos","Altiplano Cundiboyacense"
1979,"Duque, Luís & Julio César, Cubillos","Arqueología de San Agustín. Alto de los Idolos, montículos y tumbas.","","Alto de los Idolos","Cacicazgos","Alto Magdalena"
1979,"Correal, Gonzalo","Investigaciones arqueológicas en los abrigos rocosos de Nemocón y Sueva.","","Nemocón 4","Paleoindio","Altiplano Cundiboyacense"
1979,"Chaves, Alvaro & Mauricio, Puerta","Introducción a la arqueología de Fortalecillas (Neiva - Huila).","","","","Magdalena medio"
1979,"Cardale, Marianne","Textiles arqueológicos de Nariño.","","","Cacicazgos","Macizo Andino del sur"
1979,"Bray, Warwick","El Dorado, the gold of ancient Colombia. An exhibition organized by The Center for Inter-American Relations and the American Federation of Arts.","","","Cacicazgos",""
1979,"Bouchard, Jean François","Recherches archéologiques en Colombie: le projet Tumaco.","","","Cacicazgos","Costa Pacífica"
1979,"Angulo, Carlos","Concheros tardíos en el norte de Colombia.","","","","Llanuras del Caribe cuencas bajas Sinú y San Jorge"
1979,"Alcina Franch, José","La arqueología de Esmeraldas (Ecuador): introducción general.","","","Cacicazgos","Ecuador"
1978,"Van der Hammen, Thomas","Stratigraphy and environments of the Upper Quaternary of the El Abra corridor and rock shelters (Colombia).","","El Abra","Paleoindio","Altiplano Cundiboyacense"
1978,"Van der Hammen, Thomas & Gonzalo, Correal","Prehistoric man on the sabana de Bogotá: data for an ecological prehistory.","","","","Altiplano Cundiboyacense"
1978,"Uribe, María Victoria","Asentamientos prehispánicos en el altiplano de Ipiales, Colombia.","","San Luis, Las Cruces, Miraflores, Pupiales, San Francisco","Cacicazgos","Macizo Andino del sur"
1978,"Uribe, María Victoria & Roberto Lleras","Excavaciones en los cementerios protopasto y Miraflores, Nariño.","","","Cacicazgos","Macizo Andino del sur"
1978,"Silva, Eliécer","Elementos arqueológicos procedentes de las montañas de Pisba,","","","Cacicazgos","Altiplano Cundiboyacense"
1978,"Schreve-Brinkman, Elizabeth J.","A palynological study of the upper quaternary sequence in the El Abra corridor and rock shelters (Colombia).","","El Abra","Paleoindio","Altiplano Cundiboyacense"
1978,"Rozo, José","Los Muiscas. Organización social y régimen político.","","","Cacicazgos","Altiplano Cundiboyacense"
1978,"Reichel-Dolmatoff, Gerardo","Colombia Indígena período prehispánico.","","","",""
1978,"Reichel-Dolmatoff, Gerardo","Colombia indígena-período prehispánico.","","","",""
1978,"Plazas, Clemencia","Orfebrería prehistórica del altiplano nariñense, Colombia.","","","Cacicazgos","Macizo Andino del sur"
1978,"Plazas, Clemencia & Ana María Falchetti","Orfebreria prehispánica de Colombia.","","","Cacicazgos",""
1978,"Perdomo, Lucía","Taironas","","","Cacicazgos","Sierra Nevada"
1978,"Lleras, Roberto","Introducción a la crítica de la teoría sobre la prehistoria.","","","",""
1978,"Illera, Carlos","Secuencia arqueológica del municipio de Calima, El Darién, valle y su relación con las culturas de las áreas vecinas.","","","Cacicazgos","Valles alto Calima y alto y medio del Cauca"
1978,"Hernández, Guillermo","De los Chibchas a la colonia y a la República: del clan a la encomienda y al latifundio en Colombia.","","","Cacicazgos","Altiplano Cundiboyacense"
1978,"Hernández, Cecilia","Sitio de sentamiento Panche (Armero-Tolima).","","","Cacicazgos","Magdalena medio"
1978,"Falchetti, Ana María","Orfebrería Sinú.","","","Cacicazgos","Llanuras del Caribe cuencas bajas Sinú y San Jorge"
1978,"Falchetti, Ana María","Pectorales Acorazonados.","","","Cacicazgos",""
1978,"Cubillos, Julio César","Arqueología de San Agustín. Investigaciones en la Mesita C.","","Mesita C","Cacicazgos","Alto Magdalena"
1978,"Correal, Gonzalo","Apéndice A. Una tumba de pozo con cámara lateral.","","Miraflores","Cacicazgos","Macizo Andino del sur"
1978,"Chaves, Alvaro","Exploraciones y excavaciones arqueológicas en Tierradentro. Informe Correspondiente a la primera Etapa .","","","Cacicazgos","Alto Magdalena"
1978,"Chaves, Alvaro & Mauricio, Puerta","Excavaciones arqueológicas en Tierradentro y la hoya del río de la Plata.","","Aguabonita, Santa Rosa","Cacicazgos","Alto Magdalena"
1978,"Cardale, Marianne","Informe preliminar sobre una mochila Muisca hallada en la región de Pisba.","","","Cacicazgos","Altiplano Cundiboyacense"
1978,"Bray, Warwick","The gold of El Dorado.","","","Cacicazgos","Valles alto Calima y alto y medio del Cauca"
1978,"Bouchard, Jean François","El proyecto Tumaco: un programa de investigación arqueológica en la ccosta del Sur de Colombia.El proyecto de arqueología en Esmeraldas, Ecuador.","","","Cacicazgos","Costa Pacífica"
1978,"Bouchard, Jean François","Investigaciones arqueológicas en la costa Pacífica meridional de Colombia: El Proyecto Tumaco.","","","Cacicazgos","Costa Pacífica"
1978,"Bouchard, Jean François","Las culturas precolombinas del litoral pacífico ecuatorial y sus relaciones con el ecosistema.","","","Cacicazgos","Costa Pacífica"
1978,"Ardila, Isaías","El pueblo de los Guanes. Raíz gloriosa de Santander.","","","Cacicazgos","Montaña Santandereana"
1978,"Angulo, Carlos","Arqueología de la Ciénaga Grande de Santa Marta.","","Loma de López; Campo Alegre Tasajeras; Palmira","Cacicazgos","Llanuras del Caribe cuencas bajas Sinú y San Jorge"
1977,"Samper, Liliana & Marcela Torres","Arqueología y etnohistoria en el altiplano de Ipiales","","","Cacicazgos","Macizo Andino del sur"
1977,"Parsons, James","Geography as exploration and discovery.","","","",""
1977,"Correal, Gonzalo; Thomas, Van Der Hammen  & Wesley, Hurt","La ecología y tecnología de los abrigos rocosos en el Abra, sabana de Bogotá, Colombia.","","","","Altiplano Cundiboyacense"
1977,"Correal, Gonzalo","Exploraciones arqueológicas en la costa Atlántica y valle del Magdalena . I","","","Paleoindio","Magdalena medio"
1977,"Correal, Gonzalo & Thomas Van der Hammen","Investigaciones arqueológicas en los abrigos rocosos del Tequendama. 11000 años de prehistoria en la Sabana de Bogotá.","","Tequendama","Paleoindio","Altiplano Cundiboyacense"
