Contador,Autor,Año,Título,Publicado,Area
8920,"Castellanos Montes, Daniela",2004,"Etnoarqueología de la producción cerámica en Aguabuena, Ráquira. Relaciones entre el espacio, la cultura material y el registro arqueológico.",Revista de Estudiantes de Arqueología 2:20-30. Facultad de Ciencias Humanas. Universidad Nacional de Colombia.,Arqueología Colombiana
6299,"Castellanos, Gonzalo",2003,Régimen jurídico del Patrimonio Arqueológico en Colombia.,Instituto Colombiano de Antropología e Historia.,Arqueología Colombiana
5695,"Castellanos, Zaida",1975,Investigaciones arqueológicas en San Alberto-Cesar.,"Tesis de Grado Universidad de Los Andes (Inédito), Bogotá.",Arqueología Colombiana
10660,Castillo EspitiaNeyla & Francisco J. Aceituno Bocanegra,2006,"El bosque domesticado, el bosque cultivado: un proceso milenario en el Valle Medio del río Porce en el Noroccidente Colombiano.","Latin American Antiquity, 17(4): 561-578.",Arqueología Colombiana
5735,"Castillo, Neyla",1999,La Cancana: un complejo cerámico del formativo temprano en un valle interandino del noroccidente de Colombia.,"Ponencia presentada a : I Congreso de arqueología en Colombia: La Arqueología Colombiana Ante los Nuevos Paradigmas del Siglo XXI. Sociedad Colombiana de Arqueología - Universidad de Caldas Manizales, 28 al 30 de octubre de 1999.",Arqueología Colombiana
9820,"Castillo, Neyla",2004,Maestría en antropología: programa de arqueología.,"Propuesta elaborada por Neyla Castillo E. Fecha 24/05/2004. Universidad de Antioquia, Departamento de Antropología.",Arqueología Colombiana
5667,"Castillo, Neyla",1992,Investigaciones arqueológicas en el valle de Aburrá.,"Informe Departamento de Antropología de la Universidad de Antioquia y Secretaria de Educación Municipal, Medellín. Inédito.",Arqueología Colombiana
5670,"Castillo, Neyla",1985,"Investigaciones arqueológicas en el valle medio del río Cauca, Municipios de Santa Fe de Antioquia y Sopetran.","Fundación de Investigaciones Arqueológicas del Banco de la República, Bogotá.",Arqueología Colombiana
5706,"Castillo, Neyla",1984,"Investigaciones de un complejo funerario en el municipio de Sopetrán, Antioquia","Fundación de Investigaciones Arqueológicas Nacionales, Banco de la República, Bogotá.",Arqueología Colombiana
6339,"Castillo, Neyla",1997,Rescate y monitoreo arqueológico en el área del proyecto de la termoeléctrica La Sierra.,"ICAN, Inédito.",Arqueología Colombiana
5902,"Castillo, Neyla",1998,Los antiguos pobladores del Valle Medio del río Porce. Aproximación inicial desde el estudio arqueológico Porce II.,Medellín: Empresas Públicas de Medellín,Arqueología Colombiana
6268,"Castillo, Neyla",1995,Reconocimiento arqueológico en el valle del Aburrá.,"Boletín de Antropología, 9(25):49-90.",Arqueología Colombiana
6269,"Castillo, Neyla",1992,Reconocimiento arqueológico en el valle del Aburrá. Informe.,"Medellín: Universidad de Antioquia, Departamento de Antropología - Municipio de Medellín, Secretaría de Educación y Cultura. Inédito",Arqueología Colombiana
4914,"Castillo, Neyla",1997,Análisis arqueozoológico y arqueobotánico correspondiente al Proyecto de Rescate y Monitoreo de la Central Termoeléctrica La Sierra.,"ISA, Medellín. Inédito.",Arqueología Colombiana
5073,"Castillo, Neyla",1984,Arqueología de Tunja.,"Fundación de Investigaciones Arqueológicas Nacionales, Banco de la República, Bogotá.",Arqueología Colombiana
5453,"Castillo, Neyla",1981,Excavaciones arqueologicas en Tunja (II),"Tesis de Grado Universidad de Los Andes (Inédito), Bogotá.",Arqueología Colombiana
5452,"Castillo, Neyla",1981,Excavaciones arqueologicas en Tunja,"Boletín del Museo del Oro, 4:29",Arqueología Colombiana
5094,"Castillo, Neyla",1985,"Arqueología del valle medio del río Cauca, Municipios Santa Fé de Antioquia y Sopetrán.","Universidad de Antioquia, Depto de Antropología (Inédito). Medellín.",Arqueología Colombiana
6473,"Castillo, Neyla",1992,Territorio y cultura de los antiguos pobladores del Porce Medio.,"Medellín: Universidad de Antioquia, Facultad de Ciencias Sociales y Humanas, Centro de Investigaciones - Empresas Públicas de Medellín. Inédito.",Arqueología Colombiana
9819,"Castillo, Neyla  E.",2002,Propuesta para la realización de un programa de Maestría en arqueología sobre gestión del patrimonio arqueológico.,"Elaborado en noviembre de 2002. Universidad de Antioquia, Departamento de Antropología.",Arqueología Colombiana
5596,"Castillo, Neyla & Carlo Emilio Piazzini",1994,"Informe línea base componente arqueológico línea 500 Kw San Carlos-San Marcos, sector norte.",Informe Centro de investigaciones sociales.Medellín.Inédito.,Arqueología Colombiana
5595,"Castillo, Neyla & Carlo Emilio Piazzini",1994,"Informe línea base componente arqueológico línea 500 KW  San Carlos - San Marcos, sector norte. 1","Universidad de Antioquia, Centro de Investigaciones Sociales, Facultad de Ciencias Sociales y Humanas, Medellín. Ms.",Arqueología Colombiana
6669,"Castillo, Neyla & Francisco Aceituno",2000,Un modelo de ocupación durante el Holoceno Temprano y medio en el Noroccidente colombiano: el valle medio del río Porce.,"Arqueweb, 2(2):4-26.",Arqueología Colombiana
8995,"Castrillon Zapata, Rosalba",1996,Asentamientos prehispánicos en la vertiente oeste de la cordillera occidental de Antioquia. Municipio de Abriaqui.,"Trabajo de grado, Deparatmento de Antropología. Universidad de Antioquia. Medellín.",Arqueología Colombiana
5283,"Castro Sánchez, Ana María.",2005,El género como expresión simbólica. Un estudio iconográfico sobre los tunjos muiscas.,"Boletín del Museo del Oro, 53. http://www.banrep.gov.co/museo/esp/boletin.",Arqueología Colombiana
5241,"Castro, Gonzalo",1999,Dos períodos de historia regional: aportes para la interpretación de los vestigios arqueológicos en la cuenca alta de la quebrada Piedras Blancas.,Segunda Jornada Arqueológica. Universidad de Antioquia. Septiembre 2. Inédito.,Arqueología Colombiana
6202,"Castro, Sandra & Viviana Salazar Villalobos",1994,"Prospección arqueológica en el municipio de Chipatá, Santander","Tesis de Grado Universidad de Los Andes (Inédito), Bogotá.",Arqueología Colombiana
36113,"Cavelier Inés,  Camilo Rodríguez, Santiago Mora, Cristina Urrego, Luisa Fernanda Herrera",1993,La informatica en la paleoecología humana: nuevo enfoque,"Fundación Erigaie, Boletín Museo del Oro",Arqueología Colombiana
6217,"Cavelier, Inés",1995,"Prospección arqueológica para el Estudio de Impacto Ambiental del Proyecto Hidroeléctrico Miel 1, Caldas. HIDROESTUDIOS 1993 - 1994.",HIDROMIEL. Fundación Erigaie Inédito.,Arqueología Colombiana
6194,"Cavelier, Inés",1995,"Prospección arqueológica de la Termoeléctrica de Paipa, Boyacá.",AMBIOTEC.Fundación Erigaie Inédito.,Arqueología Colombiana
6265,"Cavelier, Inés",1980,Reconocimiento arqueológico en el curso alto del río Güéjar.,"Tecnoconsulta Ingenieros, (Inédito). Bogotá.",Arqueología Colombiana
6153,"Cavelier, Inés & Santiago Mora",1995,Prefacio a Ambito y ocupaciones tempranas de la América tropical.,"Ambito y ocupaciones tempranas de la América tropical, eds., Inés Cavelier y Santiago Mora. 3-4. Fundación Erigaie -Instituto Colombiano de Antropología.  Bogotá.",Arqueología Colombiana
4911,"Cavelier, Inés & Santiago Mora (eds)",1995,Ambito y ocupaciones tempranas de la América tropical.,"Eds., Inés Cavelier y Santiago Mora .Fundación Erigaie -Instituto Colombiano de Antropología, Bogotá.",Arqueología Colombiana
4891,"Cavelier, Inés et al",1995,Agroforesteria y caciques en selvas húmedas Andinas: arqueología del río La Miel.,Informe de arqueología de rescate presentado a Hidromiel S.A. 2 tomos. Bogotá.Inédito.,Arqueología Colombiana
6457,"Cavelier, Inés, Camilo, Rodríguez, Luisa .F. Herrera, Santiago, Mora",1991,Suelos antropogénicos: alternativa de producción amazonica.,"Informe final entregado al Fondo FEN, para la protección del medio ambiente. Fundación Erigaie manuscrito, Bogotá. Inédito.",Arqueología Colombiana
5575,"Cavelier, Inés; Camilo Rodríguez, Santiago Mora; Cristina Urrego & Luisa Fernanda Herrera.",1991,Informatica y ecología humana: alternativa sistemática.,"Boletín del Museo del Oro, 31:132-137.",Arqueología Colombiana
6024,"Cavelier, Inés; Camilo Rodríguez; Luisa Fernanda Herrera; Gaspar Morcote & Santiago Mora",1995,"No solo de caza vive el hombre: ocupación del bosque amazónico, Holoceno temprano.","Ambito y ocupaciones tempranas de la América tropical, eds., Inés Cavelier y Santiago Mora. 27-44. Fundación Erigaie -Instituto Colombiano de Antropología.  Bogotá.",Arqueología Colombiana
5856,"Cavelier, Inés; Herrera, Luisa Fernanda; Sneider Rojas & Fernando Montejo",2001,"Las Palmas como Mediadoras en el Origen de las Plantas Cultivadas en el Caquetá, Noroeste Amazónico.","Simposio pueblos y ambientes: una mirada al pasado precolombino. Editado por Gaspar Morcote, pp 111-119 . Academia Colombiana de Ciencias Exactas, Físicas y naturales. Editorial Guadalupe.",Arqueología Colombiana
5249,"Cavelier, Inés; Luisa Fernanda Herrera & Santiago Mora",1987,Ecología y cultura en el medio Caquetá.,"Informe preliminar Fundación Erigaie, Tropen Bos, Instituto Colombiano de Antropología, Bogotá. Inédito.",Arqueología Colombiana
5364,"Cavelier, Inés; Santiago, Mora & Luisa  F. Herrera",1990,Estabilidad y dinámica agrícola: las transformaciones de una sociedad Amazónica.,"Ingenierias prehispánicas, ed., Santiago Mora, pp, 73-109. Fondo FEN Colombia, Instituto Colombiano de Antropología.",Arqueología Colombiana
5507,"Cavelier, Inés; Santiago, Mora & Luisa  F. Herrera",1987,Fracción de Espacio: Amazonas.,Arqueología Revista Estudiantes de Antropología Universidad Nacional de Colombia. 1(3):4-12.,Arqueología Colombiana
9854,"Celis, Diego Martínez",2000,¿De qué se ríe el petroglifo? A propósito de la interpretación de un petroglifo en el altiplano Cundiboyacense (Colombia).,http://www.rupestreweb.info/risa.html RUPESTREWEB-Publicación electrónica de arte rupestre de America Latina.,Arqueología Colombiana
9847,"Celis, Diego Martínez",2005,"Propuesta para un análisis iconográfico de petroglifos: La Piedra de Sasaima, Cundinamarca (Colombia).",http://www.rupestreweb.info/sasaima2.html  RUPESTREWEB-Publicación electrónica de arte rupestre de America Latina.,Arqueología Colombiana
9852,"Celis, Diego Martínez",2005,"Propuesta para la documentación general de yacimientos rupestres: el petroglifo de la Piedra de Sasaima, Cundinamarca (Colombia).",http://www.rupestreweb.info/sasaima.html RUPESTREWEB-Publicación electrónica de arte rupestre de America Latina.,Arqueología Colombiana
9856,"Celis, Martínez Diego",1998,Historia de los procesos de documentación de arte rupestre en Colombia.,http://www.rupestreweb.info/martinez.html RUPESTREWEB-Publicación electrónica de arte rupestre de America Latina.,Arqueología Colombiana
6467,"Cely, Cristina",1977,Tejidos colombianos precolombinos: muestra Muisca y Guane.,"Tesis de Grado Universidad de Los Andes (Inédito), Bogotá.",Arqueología Colombiana
10654,"Cepek, Michael L.",2008,"Book Review: Norman E. Whitten Jr. & Dorothea Scott Whitten, Puyo Runa: Imagery and Power in Modern Amazonia. Urbana and Chicago: University of Illinois Press, 2008. 336 pp.","Anthropological Quarterly, 81(3):733-735.",Arqueología Colombiana
8826,"Chaumeil, Jean-Pierre",2005,"Un ""métdo de asimilación"". Sobre la noción e transformación en unas culturas sudamericanas.","Chamanismo y sacrificio. Perspectivas arqueológicas y etnológicas en sociedades indígenas de América del Sur, eds., Chaumael, J.P, R. Pineda, J. F. Bouchard, pp 165-176. FIAN, Banco de República. Instituto Francés de Estudios Andinos.",Arqueología Colombiana
5898,"Chaves, Alvaro",1981,Los animales mágicos de las urnas de Tierradentro.,"Revista Española de Antropología Americana. Universidad Complutense, 11:69-94, Madrid.",Arqueología Colombiana
5483,"Chaves, Alvaro",1972,Exploraciones y excavaciones arqueológicas en Tierradentro.,"Fundación de Investigaciones Arqueológicas del Banco de la República, Bogotá.",Arqueología Colombiana
5484,"Chaves, Alvaro",1978,Exploraciones y excavaciones arqueológicas en Tierradentro. Informe Correspondiente a la primera Etapa .,"Fundación de Investigaciones Arqueológicas Nacionales (Inédito), Bogotá.",Arqueología Colombiana
5570,"Chaves, Alvaro",1986,Incógnitas prehispánicas: San Agustín y Tierradentro.,"Historia de Colombia, Salvat, pp 155-179, Bogotá.",Arqueología Colombiana
4961,"Chaves, Alvaro",1972,Anotaciones sobre la cerámica Quillancinga.,"Razón y Fábula, No. 28, Bogotá",Arqueología Colombiana
5899,"Chaves, Alvaro",1981,Los animales mágicos de Tierradentro.,Museo de Artes y Tradiciones. Bogotá,Arqueología Colombiana
6705,"Chaves, Alvaro",1987,Vivienda pre-hispánica en el suroccidente de Colombia.,"Maguare,5(5):41-58.",Arqueología Colombiana
6522,"Chaves, Alvaro",1990,Tierradentro (1).,"Parques Arqueológicos de Colombia, pp. 87-113, Instituto Colombiano de Antropología, Bogotá.",Arqueología Colombiana
6521,"Chaves, Alvaro",1992,Tierradentro - San Agustín un horizonte arqueológico del sur de Colombia,"Arte de la tierra. San Agustín, Tierradentro y Corinto Cauca. Fondo de Promoción de la Cultura del Banco Popular Colección Tesoros Precolombinos. 10-16. Bogotá.",Arqueología Colombiana
6407,"Chaves, Alvaro & Gilberto Cadavid",1984,Salvamento arqueológico en Cañaveral Curití - Santander (1983-1984).,Bucaramanga: ICAN - Casa de Bolívar.,Arqueología Colombiana
5353,"Chaves, Alvaro & Mauricio, Puerta",1981,Entierro y vivienda en Monserrate Huila.,Universidad Humanística. 10(16):28- 89. Pontificia Universidad Javeriana. Bogotá.,Arqueología Colombiana
6005,"Chaves, Alvaro & Mauricio, Puerta",1986,Monumentos arqueológicos de Tierradentro.,Biblioteca Banco Popular. Bogotá.,Arqueología Colombiana
5423,"Chaves, Alvaro & Mauricio, Puerta",1977,Excavaciones arqueológicas de Tierradentro y la hoya del río de la Plata.,"Fundación de Investigaciones Arqueológicas del Banco de la República, Bogotá.",Arqueología Colombiana
5355,"Chaves, Alvaro & Mauricio, Puerta",1980,Entierros primarios de Tierradentro.,"Fundación de Investigaciones Arqueológicas Nacionales, Banco de la República, Bogotá.",Arqueología Colombiana
5613,"Chaves, Alvaro & Mauricio, Puerta",1979,Introducción a la arqueología de Fortalecillas (Neiva - Huila).,Bogotá: FIAN. Inédito.,Arqueología Colombiana
5450,"Chaves, Alvaro & Mauricio, Puerta",1978,Excavaciones arqueológicas en Tierradentro y la hoya del río de la Plata.,"Boletín del Museo del Oro, 1:50-51.",Arqueología Colombiana
5620,"Chaves, Alvaro & Mauricio, Puerta",1985,"Introducción al estudio de la vivienda prehispánica en Moscopán, Tierradentro y Aguabonita","Proyectos de Investigación realizados entre 1972 - 1984 (Resúmenes), pp. 117-119. Fundación de Investigaciones Arqueológicas Nacionales, Banco de la República, Bogotá.",Arqueología Colombiana
6683,"Chaves, Alvaro & Mauricio, Puerta",1991,Una nueva fecha para la cultura de Tierradentro.,"Universitas Humanistica, Universidad Javeriana enero - junio pp 31-37.",Arqueología Colombiana
6704,"Chaves, Alvaro & Mauricio, Puerta",1988,Vivienda precolombina e indígena actual en Tierradentro.,"Fundación de Investigaciones Arqueológicas Nacionales, Banco de la República, Bogotá.",Arqueología Colombiana
5720,"Chaves, Alvaro & Patricia Cardoso",1988,La arqueología de rescate en Colombia: problemáticas de un país multicultural.,Arqueología. Revista de Estudiantes de Antropología. Universidad Nacional de Colombia.8: 53-57.,Arqueología Colombiana
5123,"Cifuentes, Arturo",1993,Arrancaplumas y Guataqui. Dos períodos arqueológicos en el valle medio del Magdalena.,"Boletín de Arqueología, 8(2):3-88.",Arqueología Colombiana
8841,"Cifuentes, Arturo",2006,Arqueologá del piedemonte amazónico Putumayo (Colombia).,"Pueblos y paisajes antiguos de la selva Amazónica, eds., Gaspar Morcote, Santiago Mora, Carlos Franky, pp. 113-130. Universidad Nacional de Colombia, Tearaxacum.",Arqueología Colombiana
5240,"Cifuentes, Arturo",1991,Dos períodos arqueológicos del valle del río Magdalena en la región de Honda.,"Boletín de Arqueología, 6(2):1-11.",Arqueología Colombiana
6219,"Cifuentes, Arturo",1989,"Prospección y reconocimiento arqueológico en el valle del Magdalena, Municipio de Honda, Tolima.","Boletín de Arqueología, 4(3):49-56.",Arqueología Colombiana
6211,"Cifuentes, Arturo",1984,"Prospección arqueológica en la vereda Montalvo, margen izquierda del río Magdalena (El Espinal - Tolima).","Tesis de Grado Universidad Nacional de Colombia (Inédito), Bogotá.",Arqueología Colombiana
11583,"Cifuentes, Arturo",0,"Un yacimiento arqueológico antiguo  en la cuenca del río Putumayo. 3.480 A 3.360 años  antes del Presente Río Orito, Putumayo.",Inedito.,Arqueología Colombiana
31478,"Cifuentes, Arturo",0,"Un yacimiento arqueológico antiguo en la cuenca del río Putumayo. 3.480 A 3.360 años antes del Presente Río Orito, Putumayo.","Informe de arqueología de rescate, Inédito.",Arqueología Colombiana
10741,"Cifuentes, Arturo",0,"Un yacimiento arqueológico antiguo en la cuenca del río Putumayo 3.480 a 3.360 años antes del Presente Río Orito, Putumayo.",,Arqueología Colombiana
6532,"Cifuentes, Arturo",1994,Tradición alfarera de la Chamba.,"Boletín de Arqueología, 9(3):3-78.",Arqueología Colombiana
5029,"Cifuentes, Arturo & Leonardo Moreno",1987,Arqueología de rescate en el sur de Bogotá. Candelaria La Nueva.,Bogotá: ICANH - IDU. Inédito.,Arqueología Colombiana
6189,CISH,1996,Programa de prospección arqueológica de la línea troncal del gasoducto Sebastopol-Medellín. Informe final.,Centro de Investigaciones de la Facultad de Ciencias Sociales y Humanas (CISH). Inédito.,Arqueología Colombiana
4856,"Clark, R. M.",1975,A calibration curve for Radiocarbon dates.,"Antiquity, XLIX: 251-266.",Arqueología Colombiana
6213,"Clavijo, Alexander",1993,Prospección arqueológica en las inmediaciones del municipio de Roldanillo,"Tesis de Grado Universidad de Los Andes (Inédito), Bogotá.",Arqueología Colombiana
6285,"Clavijo, Alexander",2001,"Reconocimientos arqueológicos en los municipios de Bolivar, Sevilla, Caicedonia, Ulloa, Alcalá, Obando, Argelia, La Victoria (Valle del Cauca).","Arqueología preventiva en el eje cafetero. Reconocimiento y rescate arqueológico en los municipios jurisdicción del Fondo, FOREC.Vol XI.Patrimnio Arqueológico en el ordenamiento territorial. P 75-99 Instituto Colombiano de Antropología e Historia. Bogotá.",Arqueología Colombiana
6433,"Clerc, Isabel",1989,Sigilografía precolombina.,"Boletín de Antropología, 4(4):15-28.",Arqueología Colombiana
5183,CONAP - ICAN,1997,Boletín del Patrimonio Arqueológico. Número Especial.,Bogotá: Ministerio de Cultura - Instituto Colomiano de Antropología,Arqueología Colombiana
5397,"Cook, Richard",1992,Etapas tempranas de la producción de alimentos vegetales en la baja Centroamérica y partes de Colombia (región histórica Chibcha-Chocó).,"Revista de Arqueología Americana, 6:35-70.",Arqueología Colombiana
36189,"Córdoba, Liliana; García, Jharley Jair; Hoyos, Luz Stella; Duque, Constanza; Rojas, Winston; Carvajal, Silvio; Escobar, Luisa F.; Reyes, Ingrid; Cajas, Nohelia; Sánchez, Adalberto; García, Felipe; Bedoya, Gabriel; Ruiz-Linares, Andrés",2012,Composición genética de una población del suroccidente de Colombia,"Revista Colombiana de Antropología, 48(1):21-48.",Arqueología Colombiana
35958,Correa R. François,1988,Clasificación social entre hablantes de lengua Chibcha,"Maguaré, 13: 5-26.",Arqueología Colombiana
5098,"Correa, Elvia Inés",1998,Arqueología en Colombia hoy... para qué?.,"Boletín de Antropología, 12 (29): 94-112.",Arqueología Colombiana
5033,"Correa, Elvia Inés",1997,"Arqueología de rescate sí,  pero no. A propósito de un debate en arqueología.","Boletín de Antropología, 11 (27):168-186.",Arqueología Colombiana
8947,"Correa, François",2004,El sol del poder. Simbología y política entre los Muiscas del norte de los Andes.,Universidad Nacional de Colombia.,Arqueología Colombiana
4933,"Correa, François",1992,Análisis formal del vocabulario de parentesco Muisca.,"Boletín del Museo del Oro, 32-33:149-177.",Arqueología Colombiana
5326,"Correa, François",2000,El sol del poder. Simbología política entre los Muiscas.,"Sociedades complejas de la sabana de Bogotá, siglos VII al XVI d.C, eds., Braida Enciso & Monika Therrien, pp 93-116. Instituto Colombiano de Antropología.",Arqueología Colombiana
9038,"Correa, François",2005,Sociedad y naturaleza en la mitología Muisca.,"Tabula Rasa, Enero-Diciembre No 3: 197-122. Universidad Colegio Mayor de Cundinamarca. Bogotá.",Arqueología Colombiana
12793,Correal Gonzalo,2002,Evidencias culturales Pleistocenicas y del temprano Holeoceno en la Cordillera Oriental: Periodización tentativa.,"Formativo Sudamericano, una Revaluación, ed., Ledergerber-Crespo, P., pp, 63-73. Abya-Yala: Quito, Ecuador.",Arqueología Colombiana
3883,"Correal Urrego, G., Gutiérrez Olano, J., Calderón, K., Villada Cardozo, D.",2005,Evidencias arqueológicas y megafauna extinta en un salado del tardiglacial superior.,"Boletín de Arqueología, 20:1–58.",Arqueología Colombiana
5833,"Correal, Gonzalo",1974,Las Acacias: un cementerio Muisca en la Sabana de Bogotá. Características culturales y aspectos de antropología física.,"Ethnia, 4:3-16.",Arqueología Colombiana
5476,"Correal, Gonzalo",1977,Exploraciones arqueológicas en la costa Atlántica y valle del Magdalena . I,"Caldasia,11(55):33-128.",Arqueología Colombiana
5896,"Correal, Gonzalo",1990,Los albores culturales en Colombia.,"Parques Arqueológicos de Colombia, pp. 41-45, Instituto Colombiano de Antropología, Bogotá",Arqueología Colombiana
5701,"Correal, Gonzalo",1981,Investigaciones arqueológicas en Tibito. Evidencias culturales asociadas a megafauna durante el pleistoceno tardío en Colombia.,"Boletín del Museo del Oro, 4:27-28.",Arqueología Colombiana
4897,"Correal, Gonzalo",1985,Algunas enfermedades precolombinas.,"Revista de la Universidad Nacional, 1(1):14-27.",Arqueología Colombiana
4893,"Correal, Gonzalo",1989,"Aguazuque: evidencias de cazadores, recolectores y plantadores en la altiplanicie de la Cordillera Oriental.","Fundación de Investigaciones Arqueológicas Nacionales, Banco de la República, Bogotá.",Arqueología Colombiana
4892,"Correal, Gonzalo",1986,Aguazuque 1. Una estación y complejo funerario precerámico en la Sabana de Bogotá.,"Boletín de Arqueología, 3(1):3-24.",Arqueología Colombiana
5691,"Correal, Gonzalo",1979,Investigaciones arqueológicas en los abrigos rocosos de Nemocón y Sueva.,"Fundación de Investigaciones Arqueológicas Nacionales, Banco de la República, Bogotá.",Arqueología Colombiana
5445,"Correal, Gonzalo",1987,Excavaciones arqueológicas en Mosquera.,"Arqueología, 3: 13-17. Bogotá:Revista de estudiantes de Antropología. Universidad Nacional de Colombia.",Arqueología Colombiana
5365,"Correal, Gonzalo",1980,Estado actual de las investigaciones sobre la etapa lítica en Colombia.,"Antropológicas, 2:11-30",Arqueología Colombiana
4984,"Correal, Gonzalo",1996,Apuntes sobre paleopatología precolombina.,"Bioantropología de la Sabana de Bogotá, siglos VIII al XVI d.C., eds., Braida Enciso & Monika Therrien pp. 145-161. Instituto Colombiano de Antropología - Colcultura,  Bogotá.",Arqueología Colombiana
5680,"Correal, Gonzalo",1984,"Investigaciones arqueológicas en la hacienda Vistahermosa, Municipio de Mosquera.","Noticias Antropológicas Sociedad Antropológica de Colombia. N A 83, Octubre, Bogotá",Arqueología Colombiana
5131,"Correal, Gonzalo",1974,"Artefactos líticos en la hacienda Boulder, municipio de Palermo (Huila).","Revista Colombiana de Antropología, 16:195-225.",Arqueología Colombiana
5410,"Correal, Gonzalo",1981,Evidencias culturales y megafauna pleistocenica en Colombia.,"Fundación de Investigaciones Arqueológicas Nacionales, Banco de la República, Bogotá.",Arqueología Colombiana
5477,"Correal, Gonzalo",1976,Exploraciones arqueológicas en la costa Atlántica y valle del Magdalena.II,"Fundación de Investigaciones Arqueológicas del Banco de la República, Bogotá, 5 Tomos.",Arqueología Colombiana
5840,"Correal, Gonzalo",1986,Las culturas más antiguas de Colombia. Estadio de cazadores y recolectores.,"Historia de Colombia, Salvat, 73-98, Bogotá.",Arqueología Colombiana
4969,"Correal, Gonzalo",1978,Apéndice A. Una tumba de pozo con cámara lateral.,"Revista Colombiana de Antropología, 23:270-271",Arqueología Colombiana
4916,"Correal, Gonzalo",1973,Análisis craneometrico con los restos paleoindigenas del Tequendama (Colombia).,"Ethnia, 8(43):69-77.",Arqueología Colombiana
4983,"Correal, Gonzalo",1986,Apuntes sobre el medio ambiente pleistocénico y el hombre prehistórico de Colombia.,New Evidence for the Pleistocene Peopling of the Americas. pp. 115-131,Arqueología Colombiana
4874,"Correal, Gonzalo",1990,"Aclaraciones a la reseña: evidencias de cazadores, recolectores y plantadores en la altiplanicie de la Cordillera Oriental.","Boletín del Museo del Oro, 29:160-161.",Arqueología Colombiana
6673,"Correal, Gonzalo",1987,Un reconocimiento arqueológico paleontológico en Susata.,Arqueología. Revista de estudiantes de Antropología. Universidad Nacional de Colombia 1:5-8.,Arqueología Colombiana
6690,"Correal, Gonzalo",1980,Una tumba de pozo con cámara lateral en el Municipio de Armenia.,"Divulgaciones Etnológicas, Segunda época No.1: 5-8.",Arqueología Colombiana
