Contador,Autor,Año,Título,Publicado,Area
8864,"Perry, Jimena",2006,Caminos de la antropología en Colombia: Gregorio Hernández de Alba.,Universidad de Los Andes. Facultad de Ciencias Sociales - Ceso. Departamento de Antropología.,Arqueología Colombiana
36198,"Piazzini Suárez, Carlo Emilio",2015,Historiografía de la arqueología en Colombia. Una aproximación geográfica,"Revista Colombiana de Antropología, 51(2): 15-48.",Arqueología Colombiana
5558,"Piazzini, Carlo Emilio",2003,Historias de la arqueología en Colombia.,"Arqueología al Desnudo. Reflexiones sobre la práctica disciplinaria, eds., Gnneco y E. Piazzini, pp 302-325. Popayán; Universidad del Cauca.",Arqueología Colombiana
5549,"Piazzini, Carlo Emilio",1995,Historia de la arqueología en Antioquia: contextos históricos y teóricos.,"Tesis Departamento de Antropología, Universidad de Antioquía, (Inédito). Medellín.",Arqueología Colombiana
6243,"Piazzini, Carlo Emilio",1995,"Proyecto planta térmica Turbo Gas-Centro. Puerto Olaya, Cimitarra (Santander). Prospección arqueológica.","Centro de Investigaciones Sociales y Humanas, Universidad de Antioquia, Medellín, Colombia. Inédito",Arqueología Colombiana
5097,"Piazzini, Carlo Emilio",1993,"Arqueología en Antioquia: antecedentes, actualidad y perspectivas.","Actualidad Arqueológica, 2 (2):4-27.",Arqueología Colombiana
5571,"Piazzini, Carlo Emilio",1999,Indicadores de cambio e integración social en el registro arqueológico del Magdalena Medio.,Segunda Jornada Arqueológica. Universidad de Antioquia. Septiembre 2. Inédito.,Arqueología Colombiana
9138,"Piazzini, Carlo Emilio",1998,El programa de arqueología de ISA en el contexto de la arqueología colombiana.,Arqueología en estudios de impacto ambiental. Volumen 2. pp. 13-29. Medellín: ISA.,Arqueología Colombiana
5318,"Piazzini, Carlo Emilio",1998,El programa de arqueología de ISA en el contexto de la arqueología de Colombia.,Arqueología en estudios de impacto ambiental. Volumen 2. Pp. 13-29. Medellín: ISA.,Arqueología Colombiana
8937,"Piazzini, Carlo Emilio",2003,Graciliano Arcila y la arqueología en Antioquía.,"Construyendo el pasado. Cincuenta años de arqueología en Antioquia, ed., Sofía Botero, pp 17-40. Boletín de Antropología, Universidad de Antioquia, edición especial.",Arqueología Colombiana
5550,"Piazzini, Carlo Emilio",2003,Historia de la arqueología en Colombia.,"Arqueología al desnudo. Reflexiones sobre la práctica disciplinaria, eds., Cristóbal Gnecco y Emilio Piazzini, pp 301-325. Editorial Universidad del Cauca. Serie Estudios Sociales.",Arqueología Colombiana
9130,"Piazzini, Carlo Emilio",1999,Reseña: Los Antiguos Pobladores del Valle Medio del Río Porce. Aproximación Inicial desde el Estudio Arqueológico del Proyecto Porce II. Por Neyla Castillo.,"Arqueología del Área Intermedia,1: 155-157. Bogotá.",Arqueología Colombiana
9132,"Piazzini, Carlo Emilio",2003,Graciliano Arcila y la arqueología en Antioquia.,"Boletín de Antropología, Edición Especial. Construyendo el pasado. Cincuenta años de arqueología en Antioquia. Ed. S. Botero. Pp. 17-40. Medellín: Universidad de Antioquia.",Arqueología Colombiana
5103,"Piazzini, Carlo Emilio",1997,"Arqueología en estudios de impacto ambiental: calidad científica, eficiencia técnica y responsabilidad social.","Revista Técnica ISA, 5: 21-35. Medellín.",Arqueología Colombiana
9135,"Piazzini, Carlo Emilio",2000,Piamonte. Registro arqueológico de una comunidad ribereña en el Magdalena Medio.,"Revista de Antropología y Arqueología, Universidad de los Andes, 12 (1-2): 74-115.",Arqueología Colombiana
9127,"Piazzini, Carlo Emilio",2003,"Comentarios a ""Cacicazgos y guerra prehispànica en el Valle de Aburrá (Antioquia): bocetos procesuales en busca de referentes"".","Revista de Antropología y Arqueología, Universidad de los Andes,  14: 222-224.",Arqueología Colombiana
35896,"Piazzini, Carlo Emilio",2009,"Guaqueros, anticuarios y letrados: la circulación de artefactos arqueológicos en Antioquia (1850-1950).","Arqueología y etnología en Colombia: la creación de una tradición científica, eds., Carl Henrik Langebaek & Clara Isabel Botero, pp 49-78. Bogotá: Universidad de los Andes, Facultad de Ciencias Sociales, CESO, Ediciones Uniandes",Arqueología Colombiana
5348,"Piazzini, Carlo Emilio",1999,Encuentros y Desencuentros entre la Arqueología y la Historia en   Colombia.,"Ponencia presentada a : I Congreso de arqueología en Colombia: La Arqueología Colombiana Ante los Nuevos Paradigmas del Siglo XXI. Sociedad Colombiana de Arqueología - Universidad de Caldas Manizales, 28 al 30 de octubre de 1999.",Arqueología Colombiana
9137,"Piazzini, Carlo Emilio",1993,Las colecciones arqueológicas del Museo de la Universidad de Antioquia.,"El Marrón Inciso en Antioquia, pp. 25-36. Bogotá: Museo Nacional.",Arqueología Colombiana
9136,"Piazzini, Carlo Emilio",2001,"Arqueología, legislación y desarrollo: balance de los noventa y perspectivas desde la coyuntura actual.","Arqueología, patrimonio y sociedad, ed., D. Patiño. Pp. 23-40. Popayán: Universidad del Cauca.",Arqueología Colombiana
9134,"Piazzini, Carlo Emilio",2007,Nuestra Señora de la Vitoria: la solidez de una ciudad efímera.,"Escalas menores - escalas mayores. Una perspectiva arqueológica desde Colombia y Panamá, ed., L. Jaramillo, pp. 67-93. Bogotá: Uniandes - Ceso.",Arqueología Colombiana
8900,"Piazzini, Carlo Emilio",2001,Cambio e interacción social durante la época precolombina y colonial temprana en el Magdalena Medio.,"Revista de Arqueología del Área Intermedia, 3:53-93.",Arqueología Colombiana
8918,"Piazzini, Carlo Emilio",2003,Teoría en la arqueología de Colombia: un ejercicio a propósito de los umbrales epistemológicos.,Revista de Estudiantes de Arqueología 1:72-88. Facultad de Ciencias Humanas. Universidad Nacional de Colombia.,Arqueología Colombiana
35889,"Piazzini, Carlo Emilio  & Óscar Julián Moscoso",2008,Cronología arqueológica de los valles de Ciató y Risaralda en el occ idente colombiano,"Aguas arriba y aguas abajo: de la arqueología en las márgenes del Río Cauca, curso medio, ed., Luis Gonzalo Jaramillo E.  Pp 53-90 Universidad de Los Andes, Facultad de Ciencias Sociales, Departamento de Antropología, CESO, Ediciones Uniandes",Arqueología Colombiana
6129,"Piazzini, Carlo Emilio & L. C. Cardona",1997,"Piamonte: una antigua aldea ribereña en el Magdalena Medio, Puerto Olaya - Santander. Rescate arqueológico, Informe Final.",Medellín: Termocentro. Inédito.,Arqueología Colombiana
5393,"Piazzini, Carlo Emilio & Pedro Pablo Briceño",2001,"Estudios arqueológicos en Playa Rica (Calarcá, Quindío) y Ciudadela Málaga (Pereira, Risaralda).","Arqueología preventiva en el eje cafetero. Reconocimiento y rescate arqueológico en los municipios jurisdicción del Fondo, FOREC.Vol XI.Patrimnio Arqueológico en el ordenamiento territorial. P 103-118 Instituto Colombiano de Antropología e Historia.",Arqueología Colombiana
35899,"Pineda Camacho, Roberto",2009,Cronistas contemporáneos. Historia de los Institutos Etnológicos de Colombia (1930-1952),"Arqueología y etnología en Colombia: la creación de una tradición científica, eds., Carl Henrik Langebaek & Clara Isabel Botero, pp 113-172. Bogotá: Universidad de los Andes, Facultad de Ciencias Sociales, CESO, Ediciones Uniandes",Arqueología Colombiana
5922,"Pineda Camacho, Roberto",1992,Los hombres sentados del Magdalena medio: una aproximación al significado del arte funerario prehispánico.,Arte de la tierra. Sinú y río Magdalena. pp 16-20. Colección Tesoros Precolombinos. Fondo de Promoción de la Cultura. Banco Popular. Bogotá.,Arqueología Colombiana
5970,"Pineda Giraldo, Roberto",1945,Material arqueológico de la zona Calima.,"Boletín de Arqueología,1(6):491-518.",Arqueología Colombiana
5611,"Pineda, Camacho Roberto",1994,Intérpretes de milenios de diversidad.,"Exposición permanente de arqueología. Milenios de diversidad -Catálogo-Guia, pp 11-17. Bogotá: Museo Nacional de Colombia - Instituto Colombiano de Antropología.",Arqueología Colombiana
9834,"Pineda, Roberto",2005,The labyrinth of identity. Symbols of transformation and power in pre-hispanic Colombia’s precious metalwork.,"Oro de Colombia. Chamanismo y orfebreria. Museo Chileno de arte precolombino, pp. 95-109. WWW.museoprecolombino.ch",Arqueología Colombiana
5352,"Pinedo, Juan",1976,Ensayos geofísicos en arqueología.,"Tesis de Grado Universidad Nacional de Colombia (Inédito), Bogotá.",Arqueología Colombiana
4941,"Piñeros, Fernando",1989,Análisis palinológico del sitio del cráter de Merenberg (Perfil CMI).,"Cacicazgos prehispáncos del  Valle de La Plata: el contexto medioambiental de la ocupación humana, eds., Luisa F. Herrera, R. Drennan & C. Uribe, pp, 190-203. University of Pittsburgh, Universidad de Los Andes.",Arqueología Colombiana
6081,"Piñeros, Fernando",1988,"Paleoecología de los últimos 13.700 años y cambios culturales prehispánicos en la región de Merenberg, Valle de la Plata.","Tesis de Grado Universidad de Los Andes (Inédito), Bogotá.",Arqueología Colombiana
5828,"Pino, Jorge",1999,La transformación del cuarzo en la elaboración de artefactos en el valle medio del río Porce.,Segunda Jornada Arqueológica. Universidad de Antioquia. Septiembre 2. Inédito.,Arqueología Colombiana
5824,"Pino, Jorge",1999,La Tecnología del Cuarzo en el Contexto Arqueológico Colombiano.,"Ponencia presentada a : I Congreso de arqueología en Colombia: La Arqueología Colombiana Ante los Nuevos Paradigmas del Siglo XXI. Sociedad Colombiana de Arqueología - Universidad de Caldas Manizales, 28 al 30 de octubre de 1999.",Arqueología Colombiana
10177,"Pino, Salazar Jorge Iván",2008,"Acercamiento arqueológico al estudio de las expresiones rupestres en un contexto de cavernas en el Departamento de Antioquia, Colombia.","International Journal of South American Archaeology, 2: 57-65",Arqueología Colombiana
5515,"Pinto Nolla, María",2003,"Galindo, un sitio a cielo abierto de cazadores/recolectores en la sabana de Bogotá Colombia.","Fundación de Investigaciones Arqueológicas nacionales, Banco de la República. Bogotá.",Arqueología Colombiana
5946,"Pinto Nolla, María",1999,Los sistemas técnicos de la industria lítica del precerámico en Colombia. Discusión y propuesta metodológica de clasificación.,"Ponencia presentada a : I Congreso de arqueología en Colombia: La Arqueología Colombiana Ante los Nuevos Paradigmas del Siglo XXI. Sociedad Colombiana de Arqueología - Universidad de Caldas Manizales, 28 al 30 de octubre de 1999.",Arqueología Colombiana
6399,"Pinto Nolla, María, Herly Zúñiga & Olga María Torres",2001,Revisión del Género Cavia en el Registro Arqueológico Colombiano.,"Simposio pueblos y ambientes: una mirada al pasado precolombino. Editado por Gaspar Morcote, pp 47-78 . Academia Colombiana deCiencias Exactas, Físicas y naturales. Editorial Guadalupe.",Arqueología Colombiana
6508,Piperno Dolores & Deborah Pearsall,1998,The origins of agriculture in the lowlands Neotropics.,Academic Press.,Arqueología Colombiana
6128,"Piperno, Dolores",1985,"Phytolith records from prehistoric agricultural fields in the Calima region, Colombia.","Pro Calima Archaologisch-ethnologisches projekt im westlichen Kolumbien/Sedamerika, 4:37-39.  Basel.",Arqueología Colombiana
6313,"Piperno, Dolores, R.",1999,"Report on phytoliths from the site of Peña Roja, Western Amazon basin.","Fundación Eriagie, Inédito",Arqueología Colombiana
36118,"Pita Pico, Roger",2016,Historias de fortunas y desdichas: guaqueros y buscadores de tesoros en el Nuevo Reino de Granada durante la Conquista y la Colonia.,"Boletín del Museo del Oro, 56: 4-51.",Arqueología Colombiana
10181,"Plazas, Clemencia",2007,La metalurgia del área intermedia sur dentro del panorama Americano.,"International Journal of South American Archaeology, 1:33-38.",Arqueología Colombiana
5299,"Plazas, Clemencia",1990,El nuevo tesoro Quimbaya.,"Boletín del Museo del Oro, 20: 133-134.",Arqueología Colombiana
5512,"Plazas, Clemencia",1987,Función rogativa del oro Muisca.,"Maguare, 5(5):151-166.",Arqueología Colombiana
6036,"Plazas, Clemencia",1975,"Nueva  metodología para la clasificación de orfebrería prehispánica. aplicación en una muestra de figuras antropomorfas (Tunjos) de la zona Muisca,","Jorge Plazas Editor, Bogotá.",Arqueología Colombiana
6067,"Plazas, Clemencia",1978,"Orfebrería prehistórica del altiplano nariñense, Colombia.","Revista Colombiana de Antropología, 21:197-244.",Arqueología Colombiana
36119,"Plazas, Clemencia",2016,Diseño compartido entre molas gunas y cerámica prehispánica de Panamá central,"Boletín del Museo del Oro, 56: 227-289.",Arqueología Colombiana
12989,"Plazas, Clemencia",2010,"¿Nurlita, el humano-murciélago kogui, heredero del icono Tairona?","Revista de Arqueologia del Área Intermedia, 8: 159-200.",Arqueología Colombiana
5526,"Plazas, Clemencia",1983,"Gold objects from primavera: links between Calima, San Agustín and the Cauca Valley.","Pro Calima Archaologisch-ethnologisches projekt im westlichen Kolumbien/Sedamerika, 3: 40-42. Basel.",Arqueología Colombiana
5504,"Plazas, Clemencia",1987,Forma y función en el oro Tairona.,"Boletín del Museo del Oro, 19:25-33.",Arqueología Colombiana
6338,"Plazas, Clemencia & Ana María Falchetti",1987,"Poblamiento y adecuación hidráulica en el bajo río San Jorge, costa Atlántica colombiana.","Prehispanic Agricultural Fields in Andean Region, Part I, editado por W. Denevan, K. Mathewson, G. Knapp. pp 483-503. BAR international Series, 359.",Arqueología Colombiana
5146,"Plazas, Clemencia & Ana María Falchetti",1981,Asentamientos prehispánicos en el bajo río San Jorge.,"Fundación de Investigaciones Arqueológicas Nacionales, Banco de la República, Bogotá.",Arqueología Colombiana
5285,"Plazas, Clemencia & Ana María Falchetti",1981,El legendario Zenu,"Boletín del Museo del Oro, 4:20-33.",Arqueología Colombiana
5960,"Plazas, Clemencia & Ana María Falchetti",1990,Manejo hidráulico Zenú.,"Ingenierias Prehispánicas, ed., Santiago Mora, pp. 151-171 Fondo FEN Colombia, Instituto Colombiano de Antropología.",Arqueología Colombiana
6060,"Plazas, Clemencia & Ana María Falchetti",1978,Orfebreria prehispánica de Colombia.,"Boletín del Museo del Oro, 1:1-53.",Arqueología Colombiana
6105,"Plazas, Clemencia & Ana María Falchetti",1986,Patrones culturales en la orfebrería prehispánica de Colombia.,"Metalurgia de America Precolombina. 45 Congreso Internacional de Americanistas pp 201-227, Banco de la República, Bogotá.",Arqueología Colombiana
4974,"Plazas, Clemencia & Ana María Falchetti",1986,"Aprovechamiento de experiencias precolombinas. Proyecto para recuperar parte del sistema prehispánico Zenú, de manejo de las planicies de inundación, en el Bajo río San Jorge.","Boletín de Arqueología, 1(1):49-51.",Arqueología Colombiana
6533,"Plazas, Clemencia & Ana María Falchetti",1983,Tradición metalúrgica del suroccidente Colombiano.,"Boletín del Museo del Oro, 14:1-32.",Arqueología Colombiana
6068,"Plazas, Clemencia & María Alicia Uribe",1999,"Orfebrería Quimbaya: contexto, cronología  y clasificación.","Ponencia presentada a : I Congreso de arqueología en Colombia: La Arqueología Colombiana Ante los Nuevos Paradigmas del Siglo XXI. Sociedad Colombiana de Arqueología - Universidad de Caldas Manizales, 28 al 30 de octubre de 1999.",Arqueología Colombiana
5356,"Plazas, Clemencia, Ana María Falchetti, Thomas Van der Hammen & Pedro Botero",1992,"Environmental changes and cultural development in the lower San Jorge river, Colombia.","Archaeology and environment in Latin America, eds., Omar R. Ortiz-Troncoso & Thomas Van der Hammen,  pp 183-205. Instituut voor pre- en protohistorische archeologie Albert Eggs van Giffen (IPP). Universiteit van Amsterdam.van Amsterdam.",Arqueología Colombiana
10271,"Plazas, Clemencia, Ana Maria Falchetti, Thomas Van Der Hammen, &Pedro Botero",1988,Cambios ambientales y desarrollo cultural en el bajo río San Jorge.,"Revista del Museo del Oro, www.lablaa.org/.../bolmuseo/1988/bol20/bok4.htm",Arqueología Colombiana
5821,"Plazas, Clemencia; Ana María Falchetti, Juanita Sáenz y Sonia Archila",1993,La sociedad hidráulica Zenu. Estudio arqueológico de 2000 años de historia en las llanuras del Caribe colombiano.,"Banco de la República, Bogotá.",Arqueología Colombiana
5665,"Plazas, Clemencia; Ana María, Falchetti & Juanita Sáenz",1979,Investigaciones arqueológicas en el río San Jorge,"Boletín del Museo del Oro, 2:1-18.",Arqueología Colombiana
6007,"Polanco, H; B. Herazo & José Vicente Rodríguez",1990,"Morbilidad oral en esqueletos de un comunidad indígena prehispánica, Soacha Cundinamarca, Colombia I parte.","Revista de la Federación Odontológica Colombiana, 43(173):11-22.",Arqueología Colombiana
6046,"Politis, Gustavo",1996,Nukak.,"Instituto Amazónico de Investigaciones Cientificas, SINCHI",Arqueología Colombiana
6014,"Politis, Gustavo",1996,Moving to produce: Nukak mobility and settlement patterns in Amazonia.,"World Archaeology, 27(3):492-511.",Arqueología Colombiana
5778,"Politis, Gustavo",1999,La estructura del debate acerca del poblamiento temprano de América del Sur.,"Ponencia presentada a : I Congreso de arqueología en Colombia: La Arqueología Colombiana Ante los Nuevos Paradigmas del Siglo XXI. Sociedad Colombiana de Arqueología - Universidad de Caldas Manizales, 28 al 30 de octubre de 1999.",Arqueología Colombiana
10013,"Politis, Gustavo",2007,Nukak: ethnoarchaeology of an Amazonian people.,"Walnut Creek, Ca University College London Institute of Archaeology Publications.",Arqueología Colombiana
4869,"Politis, Gustavo",2004,Acerca de la arqueología en Colombia.,"Revista de Estudiantes de Arqueología 2:70-83. Faculta de ciencias Humanas, Universidad nacional de Colombia.",Arqueología Colombiana
5933,"Politis, Gustavo",1992,Los Nukak: La arquitectura del nomadismo en la amazonia colombiana.,"Proa, 412:11-20.",Arqueología Colombiana
5589,"Politis, Gustavo",1991,Informe de viaje al territorio Nukak en septiembre de 1990.,"Informe presentado a la Oficina de Asuntos Indígenas del Ministerio del Interior, Bogotá Colombia. Inédito.",Arqueología Colombiana
5747,"Politis, Gustavo & C. Gamble",1994,La colonización de la foresta tropical Amazónica en relación con el poblamiento de América del sur.,"Revista del Museo de Historia Natural de San Rafael (Mendoza), 12(1/4):43-47.",Arqueología Colombiana
5592,"Politis, Gustavo & G. Martínez",1991,Informe del trabajo de campo realizado en el territorio Nukak en Julio de 1991.,"Informe presentado al CONICET y Universidad Nacional de La Plata, Argentina. Inédito.",Arqueología Colombiana
5823,"Politis, Gustavo & G. Martínez",1992,La subsistencia invernal de un grupo de los Nukak Nor-Occidental del Guaviare.,Ponencia presentada al 6 Congreso Nacional de Antropología de Colombia. Simposio pasado y presente de los cazadores recolectores en América del sur. Bogotá.,Arqueología Colombiana
4901,"Politis, Gustavo & Julián Rodríguez",1994,Algunos aspectos de la subsistencia de los Nukak de la Amazonía Colombiana.,"Colombia Amazónica, 7(1-2):169-207.",Arqueología Colombiana
8903,"Politis, Gustavo G.",2000,Patrones de descarte de los nukak: implicaciones para la arqueología de los cazadores-recolectores.(1),"Arqueología del Área Intermedia, 2:99-124.",Arqueología Colombiana
12988,"Posada Restrepo William, Luis Norberto Parra & Daniel Francisco Jaramillo",2010,"Procesos antrópicos y procesos naturales a escala de sitio. Un caso de geoarqueología en el municipio de Frontino, noroccidente colombiano.","Revista de Arqueologia del Área Intermedia, 8:121-158.",Arqueología Colombiana
5951,"Pradilla, Helena",1984,Los Tunebos a través de su historia de origen.,"Tesis de Grado Universidad Nacional de Colombia (Inédito), Bogotá.",Arqueología Colombiana
5376,"Pradilla, Helena, Germán Villate, Luís Wiesner & Francisco Ortiz.",1991,Estudio arqueológico de la UPTC.,Informe de investigación presentado al Instituto Colombiano de Antropología. 2 Tomos. Bogotá.Inédito.,Arqueología Colombiana
6242,"Pradilla, Helena; Blanca Acuña & Franz R. Flórez Fuya",1999,"Proyecto nueva prospección en el lote ""El Corazón"" Nº 9005.046 (Antigua investigación arqueológica y etnohistórica del Bosque - Sector sur).",Tunja:Museo Arqueológico de Tunja - Universidad Pedagógica y Tecnológica de Colombia. Inédito.,Arqueología Colombiana
6101,"Pradilla, Helena; Germán Villate; Francisco Ortiz",1994,Patrimonio arqueológico. Hacia una política de manejo.,"Informe de Investigación UPTC,Tunja. Inédito.",Arqueología Colombiana
5378,"Pradilla, Helena; Germán Villate; Francisco Ortiz",1991,Estudio arqueológico de la UPTC. El Corazon.,"Informe de Investigación UPTC, Tunja.Inédito.",Arqueología Colombiana
5377,"Pradilla, Helena; Germán Villate; Francisco Ortiz",1988,Estudio arqueológico de la UPTC.  El Establo.,"Informe de Investigación. ICFES, UPTC, U. Nacional,Tunja. Inédito.",Arqueología Colombiana
5082,"Pradilla, Helena; Germán Villate; Francisco Ortiz",1992,Arqueología del cercado grande de los santuarios.,"Boletín del Museo del Oro, 32-33:21-147.",Arqueología Colombiana
5379,"Pradilla, Helena; Germán Villate; Francisco Ortiz",1990,Estudio arqueológico de la UPTC. Laboratorio La Muela.,"Informe de Investigación, Colcultura, UPTC, U. Nacional, Tunja.Inédito.",Arqueología Colombiana
6102,"Pradilla, Helena; Luís Wiesner G.; Francisco Ortiz  & German Villate.",1993,Patrimonio Arqueológico: hacia una política de manejo.,Universidad Pedagogica y tecnológica de Colombia. Tunja.,Arqueología Colombiana
5930,"Pradilla, Natalia; Margarita Reyes & Carlos López",1988,"Los museos y su incidencia en la educación, difusión y toma de conciencia de la importancia del pasado regional",Arqueología. Revista de estudiantes de Antropología. Universidad Nacional de Colombia 6:26-29.,Arqueología Colombiana
5124,"Preuss, Konrad Th.",1931,Arte monumental prehistórico excavaciones hechas en el alto Magdalena y San Agustín.,Escuelas Salecianas. Bogotá.,Arqueología Colombiana
5702,"Puerta, Mauricio",1981,"Investigaciones arqueológicas en Tierradentro ( Inza, Turminá, Mosoco).","Fundación de Investigaciones Arqueológicas del Banco de la República, Bogotá.",Arqueología Colombiana
5435,"Puerta, Mauricio",1973,Excavaciones arqueológicas en la región de Tierradentro.,"Tesis de Grado Universidad de Los Andes (Inédito), Bogotá.",Arqueología Colombiana
6209,"Pulido, René Alejandro",1993,"Prospección arqueológica en la cuenca media del río Dagua, Valle del Cauca","Tesis de Grado Universidad de Los Andes (Inédito), Bogotá.",Arqueología Colombiana
4931,"Pulido, René Alejandro",1996,Análisis del material arqueológico recuperado durante las excavaciones del punto K4+750 del gasoducto Montañuelo-Gualanday.,"ICAN, Inédito.",Arqueología Colombiana
5609,"Quattrin, D.W",1995,"Interaction and exchange during the formative period (1000 BC-AD1) in the Valle de La Plata, Colombia.","Ph.D. Dissertation, University of Pittsburgh, Pittsburgh, PA.",Arqueología Colombiana
35964,"Quiñones Edixon & Liliana Segura,",1998,Aportes al conocimiento bioantropológico de la población prehispánica del Cercado Grande de los Santuarios,"Maguaré,13: 165-178.",Arqueología Colombiana
35785,"Quiñones Triana, Yago",2018,"Quimeras, ontologías y perspectivismo para una revisión de la cultura arqueológica chamánica de San Agustín","Boletín de Antropología, 33(55):297-322.",Arqueología Colombiana
35891,"Quintana Urrea, Leonardo Iván",2008,"Patrones de enterramiento, arquitectura y costumbres funerarias entre los grupos tardíos del Quindío: un cementerio prehispánico en la Tebaida-Sitio Villa Juliana","Aguas arriba y aguas abajo: de la arqueología en las márgenes del Río Cauca, curso medio, ed.,  Luis Gonzalo Jaramillo E.  Pp 117-140 Universidad de Los Andes, Facultad de Ciencias Sociales, Departamento de Antropología, CESO, Ediciones Uniandes",Arqueología Colombiana
6049,"Quintero, Ninfa Isabel",2001,Ocupación Humana Según Unidades de Paisaje en la Vertiente del Río La Miel.,"Simposio pueblos y ambientes: una mirada al pasado precolombino. Editado por Gaspar Morcote, pp 275-285 . Academia Colombiana de Ciencias Exactas, Físicas y naturales. Editorial Guadalupe.",Arqueología Colombiana
6525,"Quintero, Ricardo",1956,"Tierradentro, territorio incógnito.",Monografía sobre Tierradentro.,Arqueología Colombiana
5121,"Raigoza, Adriana & Diego Otero",1999,Arquitectura prehisánica en la región Arqueológica Calima (1.500 a.C. - 1.550 d.C.).,"Ponencia presentada a : I Congreso de arqueología en Colombia: La Arqueología Colombiana Ante los Nuevos Paradigmas del Siglo XXI. Sociedad Colombiana de Arqueología - Universidad de Caldas Manizales, 28 al 30 de octubre de 1999.",Arqueología Colombiana
36055,"Ramírez Quiroga , Alexander Mauricio",2015,"Petropintura. La piedra como soporte perenne proceso de creación estética, a partir de una reflexión de los vestigios patrimoniales",Universidad Tecnológica de Pereira. Facultad de Bellas Artes y Humanidades. Escuela de Artes Visuales. Licenciatura en Artes Visules. Pereira,Arqueología Colombiana
5566,"Ramírez, Alexandra",2001,Identificación de Rasgos Diagnósticos en Tuberosas Altoandinas Contemporáneas para la Clasificación de Restos Vegetales de Origen Arqueológico.,"Simposio pueblos y ambientes: una mirada al pasado precolombino. Editado por Gaspar Morcote, pp 225-242 . Academia Colombiana de Ciencias Exactas, Físicas y naturales. Editorial Guadalupe.",Arqueología Colombiana
